id,region_id,text,rating,provider,source,is_hidden,hiding_type,hiding_reason,url,likes_count,comments_count,date_created,date_edited,object,user,official_answer,photos,additional_data,on_moderation,is_rated,is_verified
9171415,32,"Была произведена установка сигнализации охраны с датчиками на окна и двери, пожарной сигнализации и кнопки, пока доволен. Установка аккуратная и быстрая, сделали так как я хотел, делали без возмущений с понимание, всё спрятано, для меня это было большим удивлением и было очень приятно. Что по сигнализации охраны, был заключён договор о материально ответственно части со стороны компании, большой плюс!!! Надеюсь что судится всё-таки не прийдётся так как в договоре прописано что деньги выплачиваются в до судебном порядке и в установленные сроки, пожарную сигнализацию надеюсь проверять не будем, в тестах всё работает, на дым и огонь реагирует... дальше надеюсь не чего и не куда не зайдёт... что говоря о кнопке вызова, есть тестовый выезд, то Я ПРОСТО НЕ МОГ НЕ ПОПРОБОВАТЬ!!!! Это приятно удивило! Среагировали быстро, приехали один раз за 4 минут. После пришлось нажимать по реальной ситуации...пару раз уложились в 10минут, но это был час пик!!! По приезду пообщались, они объяснили что разряд у них 6, честно говоря я не знаю что это значит... но приезжали бугаи 2х2 со спец средствами,  и наручникмм, сами в бронежилетах и разгрузках, одним своим видом могут навести ужас. Я доволен пока что этой компанией надеюсь они меня не будут разочаровывать.",5,flamp,,False,,,https://flamp.ru/r/70000001028963932/5075060,0,0,2019-02-28T22:11:20.0+07:00,,"{'id': '70000001028963932', 'type': 'branch'}","{'id': '2871398', 'reviews_count': 1, 'first_name': 'vic.dmitreev', 'last_name': None, 'name': 'vic.dmitreev', 'provider': 'flamp', 'photo_preview_urls': {'1920x': 'https://cdn1.flamp.ru/15c3670f41cd42c519fc96dbb27c8523_1920.jpeg', '320x': 'https://cdn1.flamp.ru/15c3670f41cd42c519fc96dbb27c8523_320.jpeg', '640x': 'https://cdn1.flamp.ru/15c3670f41cd42c519fc96dbb27c8523_640.jpeg', '64x64': 'https://cdn1.flamp.ru/15c3670f41cd42c519fc96dbb27c8523_64_64.jpeg', 'url': 'https://cdn1.flamp.ru/15c3670f41cd42c519fc96dbb27c8523.jpeg'}, 'url': 'http://flamp.ru/user2871398', 'additional_data': {'email': None}}",,[],"{'status_history': [], 'has_unresolved_complaints': False, 'pin_status': 'none', 'ip': '', 'user_agent': '', 'external_id': '5075060', 'filtered_facts': None, 'is_unrated_permanently': None, 'is_liked': None}",False,True,False
9160220,32,"Пользовался услугами другой компании почти пол года, они же и проектировали и устанавливали всю систему. Сколько же крови они выпили. Мало того что все время приходят смс о не уплате, так и ложных сработок было не мало. Короче перешел на обслуживание к дельта - пока все супер, очень доволен.",5,2gis,,False,,,,0,0,2019-02-27T23:32:28.17096+07:00,,"{'id': '70000001028963932', 'type': 'branch'}","{'id': '17857602', 'reviews_count': 1, 'first_name': 'Василий Семенов', 'last_name': None, 'name': 'Василий Семенов', 'provider': '2gis', 'photo_preview_urls': {'1920x': 'https://i1.photo.2gis.com/images/profile/844424968462861_8c5d_1920x.jpg', '320x': 'https://i1.photo.2gis.com/images/profile/844424968462861_8c5d_320x.jpg', '640x': 'https://i1.photo.2gis.com/images/profile/844424968462861_8c5d_640x.jpg', '64x64': 'https://i1.photo.2gis.com/images/profile/844424968462861_8c5d_64x64.jpg', 'url': 'https://i1.photo.2gis.com/images/profile/844424968462861_8c5d.jpg'}, 'url': '', 'additional_data': {'email': None}}",,[],"{'status_history': [], 'has_unresolved_complaints': False, 'pin_status': 'none', 'ip': '', 'user_agent': '', 'external_id': None, 'filtered_facts': None, 'is_unrated_permanently': None, 'is_liked': None}",False,True,False
9159707,32,"Охраняюсь дельтой на протяжение 2 лет загородный дом, до этого была ситуация что забрались в дом и обокрали, теперь я нахожусь под охранной, на протяжении 2 лет никто не смел сунутся ко мне в дом, видимо наклейка и видеокамеры пугают!",5,2gis,,False,,,,0,0,2019-02-27T22:46:22.422678+07:00,,"{'id': '70000001028963932', 'type': 'branch'}","{'id': '17856355', 'reviews_count': 3, 'first_name': 'Роман Харитонов', 'last_name': None, 'name': 'Роман Харитонов', 'provider': '2gis', 'photo_preview_urls': {'1920x': 'https://i6.photo.2gis.com/images/profile/844424968422886_615d_1920x.jpg', '320x': 'https://i6.photo.2gis.com/images/profile/844424968422886_615d_320x.jpg', '640x': 'https://i6.photo.2gis.com/images/profile/844424968422886_615d_640x.jpg', '64x64': 'https://i6.photo.2gis.com/images/profile/844424968422886_615d_64x64.jpg', 'url': 'https://i6.photo.2gis.com/images/profile/844424968422886_615d.jpg'}, 'url': '', 'additional_data': {'email': None}}",,[],"{'status_history': [], 'has_unresolved_complaints': False, 'pin_status': 'none', 'ip': '', 'user_agent': '', 'external_id': None, 'filtered_facts': None, 'is_unrated_permanently': None, 'is_liked': None}",False,True,False
9148600,32,"Длительное время пользуюсь услугами охраны Дельта. Могу сказать, что оперативность реагирования команды достойна похвалы, не раз выручали. У нас большой объект, проблемы бывают периодически со срабатыванием сигнализации. Все быстро решается",5,2gis,,False,,,,0,0,2019-02-27T00:52:36.618388+07:00,,"{'id': '70000001028963932', 'type': 'branch'}","{'id': '17843902', 'reviews_count': 1, 'first_name': 'Вадим Петров', 'last_name': None, 'name': 'Вадим Петров', 'provider': '2gis', 'photo_preview_urls': {'1920x': 'https://i1.photo.2gis.com/images/profile/844424968422559_a05d_1920x.jpg', '320x': 'https://i1.photo.2gis.com/images/profile/844424968422559_a05d_320x.jpg', '640x': 'https://i1.photo.2gis.com/images/profile/844424968422559_a05d_640x.jpg', '64x64': 'https://i1.photo.2gis.com/images/profile/844424968422559_a05d_64x64.jpg', 'url': 'https://i1.photo.2gis.com/images/profile/844424968422559_a05d.jpg'}, 'url': '', 'additional_data': {'email': None}}",,[],"{'status_history': [], 'has_unresolved_complaints': False, 'pin_status': 'none', 'ip': '', 'user_agent': '', 'external_id': None, 'filtered_facts': None, 'is_unrated_permanently': None, 'is_liked': None}",False,True,False
9143799,32,"Выезд экипажа был 21.02.2019 года в салон красоты по улице советской. Хочу поблагодарить вас за вашу толирратность и в то же время умение в рамках закона уладить конфликт. помогли нам очень. Обязательно напишу отзыв и письмо на ваш официальный сайт, чтоб ГБР отблагодарили. Приехали за 5 минут, успокоили девочек работниц добрым словом, вывели хулигана, теперь все вокруг знают, что у нас Охрана надежная и к нам надеюсь больше не придут сомнительные люди.",5,flamp,,False,,,https://flamp.ru/r/70000001028963932/5067311,0,0,2019-02-26T17:47:17.0+07:00,,"{'id': '70000001028963932', 'type': 'branch'}","{'id': '2867105', 'reviews_count': 1, 'first_name': 'oolyusik', 'last_name': None, 'name': 'oolyusik', 'provider': 'flamp', 'photo_preview_urls': {'1920x': 'https://cdn1.flamp.ru/2f02eea54774ed43eb8fc85808ef7e97_1920.jpeg', '320x': 'https://cdn1.flamp.ru/2f02eea54774ed43eb8fc85808ef7e97_320.jpeg', '640x': 'https://cdn1.flamp.ru/2f02eea54774ed43eb8fc85808ef7e97_640.jpeg', '64x64': 'https://cdn1.flamp.ru/2f02eea54774ed43eb8fc85808ef7e97_64_64.jpeg', 'url': 'https://cdn1.flamp.ru/2f02eea54774ed43eb8fc85808ef7e97.jpeg'}, 'url': 'http://flamp.ru/user2867105', 'additional_data': {'email': None}}",,[],"{'status_history': [], 'has_unresolved_complaints': False, 'pin_status': 'none', 'ip': '', 'user_agent': '', 'external_id': '5067311', 'filtered_facts': None, 'is_unrated_permanently': None, 'is_liked': None}",False,True,False
9125976,32,"В целом я доволен работой Дельты. Обратился к ним около полугода назад. Требовалось обеспечить охрану ресторана и их посоветовал мой очень хороший знакомый. И хотя, конечно полагаться полностью на чужое мнение в таком деле было бы глупо, в любом случае, оценивал сам, подходят или нет. Сразу сложилось довольно хорошее мнение о них.Порадовал их подход к работе. Как подписали договор, сразу взялись за дело - быстро подключили систему, протестировали. Пока никаких проблем не возникало с ними.",4,flamp,,False,,,https://flamp.ru/r/70000001028963932/5062050,0,0,2019-02-25T02:56:12.0+07:00,,"{'id': '70000001028963932', 'type': 'branch'}","{'id': '2864643', 'reviews_count': 1, 'first_name': 'Alexander', 'last_name': None, 'name': 'Alexander', 'provider': 'flamp', 'photo_preview_urls': {'1920x': 'https://cdn1.flamp.ru/default-avatar-m_1920.png', '320x': 'https://cdn1.flamp.ru/default-avatar-m_320.png', '640x': 'https://cdn1.flamp.ru/default-avatar-m_640.png', '64x64': 'https://cdn1.flamp.ru/default-avatar-m_64_64.png', 'url': 'https://cdn1.flamp.ru/default-avatar-m.png'}, 'url': 'http://flamp.ru/user2864643', 'additional_data': {'email': None}}",,[],"{'status_history': [], 'has_unresolved_complaints': False, 'pin_status': 'none', 'ip': '', 'user_agent': '', 'external_id': '5062050', 'filtered_facts': None, 'is_unrated_permanently': None, 'is_liked': None}",False,True,False
9124536,32,"За пять лет обслуживания все нормально, пару раз приезжали на тревогу .В Дельта есть разрешение на оружие и дубинки. Могу рекомендовать",5,2gis,,False,,,,0,0,2019-02-24T23:25:02.765974+07:00,,"{'id': '70000001028963932', 'type': 'branch'}","{'id': '17814179', 'reviews_count': 1, 'first_name': 'Евгений Репин', 'last_name': None, 'name': 'Евгений Репин', 'provider': '2gis', 'photo_preview_urls': {'1920x': 'https://i0.photo.2gis.com/images/profile/844424968421947_87ec_1920x.jpg', '320x': 'https://i0.photo.2gis.com/images/profile/844424968421947_87ec_320x.jpg', '640x': 'https://i0.photo.2gis.com/images/profile/844424968421947_87ec_640x.jpg', '64x64': 'https://i0.photo.2gis.com/images/profile/844424968421947_87ec_64x64.jpg', 'url': 'https://i0.photo.2gis.com/images/profile/844424968421947_87ec.jpg'}, 'url': '', 'additional_data': {'email': None}}",,[],"{'status_history': [], 'has_unresolved_complaints': False, 'pin_status': 'none', 'ip': '', 'user_agent': '', 'external_id': None, 'filtered_facts': None, 'is_unrated_permanently': None, 'is_liked': None}",False,True,False
9115111,32,"Подключил услугу, по которой охрану обеспечивает Охранный Холдинг. Дельта! Через 2,5 часа приехали сотрудники, подписали договор, установили аппаратуру (без единого сверления). Теперь за те же деньги, что я платил на старой своей квартире, я имею полноценную уверенность в защите. Настоящие профессионалы. А ребят из группы реагирования я видел на выставке по безопасности в Москве.Респект!",5,2gis,,False,,,,0,0,2019-02-23T23:07:49.570601+07:00,,"{'id': '70000001028963932', 'type': 'branch'}","{'id': '17802556', 'reviews_count': 1, 'first_name': 'Виктор Минченко', 'last_name': None, 'name': 'Виктор Минченко', 'provider': '2gis', 'photo_preview_urls': {'1920x': 'https://i0.photo.2gis.com/images/profile/844424968423613_df06_1920x.jpg', '320x': 'https://i0.photo.2gis.com/images/profile/844424968423613_df06_320x.jpg', '640x': 'https://i0.photo.2gis.com/images/profile/844424968423613_df06_640x.jpg', '64x64': 'https://i0.photo.2gis.com/images/profile/844424968423613_df06_64x64.jpg', 'url': 'https://i0.photo.2gis.com/images/profile/844424968423613_df06.jpg'}, 'url': '', 'additional_data': {'email': None}}",,[],"{'status_history': [], 'has_unresolved_complaints': False, 'pin_status': 'none', 'ip': '', 'user_agent': '', 'external_id': None, 'filtered_facts': None, 'is_unrated_permanently': None, 'is_liked': None}",False,True,False
9081743,32,"У меня под охраной от дельты склад. Все устраивает. Привлекло, что есть материальная ответственность. Если не успеют приехать, то выплачивают ущерб. Сумма материальной отвественности прописано в договоре. А мне это очень важно. А охранники высшего разряда! Спасибо за спокойствие",4,2gis,,False,,,,0,0,2019-02-20T20:10:47.935117+07:00,,"{'id': '70000001028963932', 'type': 'branch'}","{'id': '17759923', 'reviews_count': 1, 'first_name': 'Аллочка Долматова (Попкова)', 'last_name': None, 'name': 'Аллочка Долматова (Попкова)', 'provider': '2gis', 'photo_preview_urls': {'1920x': 'https://i3.photo.2gis.com/images/profile/844424968627143_a037_1920x.jpg', '320x': 'https://i3.photo.2gis.com/images/profile/844424968627143_a037_320x.jpg', '640x': 'https://i3.photo.2gis.com/images/profile/844424968627143_a037_640x.jpg', '64x64': 'https://i3.photo.2gis.com/images/profile/844424968627143_a037_64x64.jpg', 'url': 'https://i3.photo.2gis.com/images/profile/844424968627143_a037.jpg'}, 'url': '', 'additional_data': {'email': None}}",,[],"{'status_history': [], 'has_unresolved_complaints': False, 'pin_status': 'none', 'ip': '', 'user_agent': '', 'external_id': None, 'filtered_facts': None, 'is_unrated_permanently': None, 'is_liked': None}",False,True,False
9062675,32,"Сколько пользуюсь охраной, никаких существенных недостатков я в этой системе не нашла. Хотя с Дельтой мы с 2014 года! Все стабильно работает, смс-оповещение моментальное, может мне повезло? Но каждый год сотрудники проводят обследование работоспособности системы как и положено, с оплатой тоже всегда строго вовремя, никаких сбоев или недоразумений.",4,flamp,,False,,,https://flamp.ru/r/70000001028963932/5044744,0,0,2019-02-19T02:48:34.0+07:00,,"{'id': '70000001028963932', 'type': 'branch'}","{'id': '2855550', 'reviews_count': 1, 'first_name': 'Лилия', 'last_name': None, 'name': 'Лилия', 'provider': 'flamp', 'photo_preview_urls': {'1920x': 'https://cdn1.flamp.ru/default-avatar-m_1920.png', '320x': 'https://cdn1.flamp.ru/default-avatar-m_320.png', '640x': 'https://cdn1.flamp.ru/default-avatar-m_640.png', '64x64': 'https://cdn1.flamp.ru/default-avatar-m_64_64.png', 'url': 'https://cdn1.flamp.ru/default-avatar-m.png'}, 'url': 'http://flamp.ru/user2855550', 'additional_data': {'email': None}}",,[],"{'status_history': [], 'has_unresolved_complaints': False, 'pin_status': 'none', 'ip': '', 'user_agent': '', 'external_id': '5044744', 'filtered_facts': None, 'is_unrated_permanently': None, 'is_liked': None}",False,True,False
9062251,32,"Мы пользуемся услугами службы охраны Дельта наше предприятие занимается изготовлением метало пластиковых конструкций , ОГРОМНОЕ Спасибо ребятам охранной компании , за то что вовремя среагировали и предотвратили попытку хищения и вывоза среди белого дня ТМЦ.",5,flamp,,False,,,https://flamp.ru/r/70000001028963932/5044629,0,0,2019-02-19T01:24:32.0+07:00,,"{'id': '70000001028963932', 'type': 'branch'}","{'id': '2855484', 'reviews_count': 1, 'first_name': 'andrei lavrov', 'last_name': None, 'name': 'andrei lavrov', 'provider': 'flamp', 'photo_preview_urls': {'1920x': 'https://cdn1.flamp.ru/default-avatar-m_1920.png', '320x': 'https://cdn1.flamp.ru/default-avatar-m_320.png', '640x': 'https://cdn1.flamp.ru/default-avatar-m_640.png', '64x64': 'https://cdn1.flamp.ru/default-avatar-m_64_64.png', 'url': 'https://cdn1.flamp.ru/default-avatar-m.png'}, 'url': 'http://flamp.ru/user2855484', 'additional_data': {'email': None}}",,[],"{'status_history': [], 'has_unresolved_complaints': False, 'pin_status': 'none', 'ip': '', 'user_agent': '', 'external_id': '5044629', 'filtered_facts': None, 'is_unrated_permanently': None, 'is_liked': None}",False,True,False
9048431,32,"Два года стоит охранная сигнализация от Дельты, честно сказать не разу не задумалась об качестве, но не так давно после корпоратива вернулась поздно так сказать веселенькой:)) Забыла про сигнализацию, минут через пять приехали ребята в спецформе, со сперц средствами, думала уже все придется платить штраф за ложный вызов, но не одного грубого слово не услышала в свой адрес и ничего не платила за свою оплошность. Мне рассказали, что у меня есть право на тестовый выезд, чтоб проверить свою компанию по безопасности))",4,2gis,,False,,,,0,0,2019-02-17T21:19:44.266429+07:00,,"{'id': '70000001028963932', 'type': 'branch'}","{'id': '17718074', 'reviews_count': 2, 'first_name': 'Кариno4ka Saraevskay', 'last_name': None, 'name': 'Кариno4ka Saraevskay', 'provider': '2gis', 'photo_preview_urls': {'1920x': 'https://i0.photo.2gis.com/images/profile/844424968425599_8a3d_1920x.jpg', '320x': 'https://i0.photo.2gis.com/images/profile/844424968425599_8a3d_320x.jpg', '640x': 'https://i0.photo.2gis.com/images/profile/844424968425599_8a3d_640x.jpg', '64x64': 'https://i0.photo.2gis.com/images/profile/844424968425599_8a3d_64x64.jpg', 'url': 'https://i0.photo.2gis.com/images/profile/844424968425599_8a3d.jpg'}, 'url': '', 'additional_data': {'email': None}}",,[],"{'status_history': [], 'has_unresolved_complaints': False, 'pin_status': 'none', 'ip': '', 'user_agent': '', 'external_id': None, 'filtered_facts': None, 'is_unrated_permanently': None, 'is_liked': None}",False,True,False
9041172,32,"Работаю с Дельтой около двух лет, могу сказать, что это не плохая компания, на твёрдую 4 может даже с плюсом (минус в стоимости беспроводного оборудования). Но сколько с ними работаем, ещё не разу не было проблем.",4,flamp,,False,,,https://flamp.ru/r/70000001028963932/5038991,0,0,2019-02-17T01:51:30.0+07:00,,"{'id': '70000001028963932', 'type': 'branch'}","{'id': '2852670', 'reviews_count': 1, 'first_name': 'Николай', 'last_name': None, 'name': 'Николай', 'provider': 'flamp', 'photo_preview_urls': {'1920x': 'https://cdn1.flamp.ru/default-avatar-m_1920.png', '320x': 'https://cdn1.flamp.ru/default-avatar-m_320.png', '640x': 'https://cdn1.flamp.ru/default-avatar-m_640.png', '64x64': 'https://cdn1.flamp.ru/default-avatar-m_64_64.png', 'url': 'https://cdn1.flamp.ru/default-avatar-m.png'}, 'url': 'http://flamp.ru/user2852670', 'additional_data': {'email': None}}",,[],"{'status_history': [], 'has_unresolved_complaints': False, 'pin_status': 'none', 'ip': '', 'user_agent': '', 'external_id': '5038991', 'filtered_facts': None, 'is_unrated_permanently': None, 'is_liked': None}",False,True,False
9035467,32,"Заказывали услуги пультовой охраны небольшого магазина. Установили все необходимое оборудование, выдали всем кассирам специальные брелки. Периодически поступают сигналы проверить качество работы охранной службы. Так как услугами пользуемся совсем недавно, было всего-лишь три вызова по тревожной кнопке. Охранная служба появлялась на месте вызова быстро в полном обмундировании и боевой готовности",5,flamp,,False,,,https://flamp.ru/r/70000001028963932/5037556,0,0,2019-02-16T16:41:14.0+07:00,,"{'id': '70000001028963932', 'type': 'branch'}","{'id': '2775749', 'reviews_count': 1, 'first_name': 'Майк Смелов', 'last_name': None, 'name': 'Майк Смелов', 'provider': 'flamp', 'photo_preview_urls': {'1920x': 'https://cdn1.flamp.ru/default-avatar-m_1920.png', '320x': 'https://cdn1.flamp.ru/default-avatar-m_320.png', '640x': 'https://cdn1.flamp.ru/default-avatar-m_640.png', '64x64': 'https://cdn1.flamp.ru/default-avatar-m_64_64.png', 'url': 'https://cdn1.flamp.ru/default-avatar-m.png'}, 'url': 'http://flamp.ru/user2775749', 'additional_data': {'email': None}}",,[],"{'status_history': [], 'has_unresolved_complaints': False, 'pin_status': 'none', 'ip': '', 'user_agent': '', 'external_id': '5037556', 'filtered_facts': None, 'is_unrated_permanently': None, 'is_liked': None}",False,True,False
8993965,32,"Добрый день, начну с того что достаточно долго выбирал охранную компанию для своего офиса, остановился на компании Дельта"", так как цена у них самая низкая среди крупных охранных служб, и ни разу не пожалел, монтаж был осуществлён за 4 часа, все сделали качественно и быстро. Приезжают достаточно быстро - 5-8 минут. Я всем доволен. Если вам ещё посчастливиться попасть на менеджера Викторию, тогда вы можете быть спокойны, консультирует по делу и предлагает разные варианты и по стоимости и по надёжности, можно ещё долго рассказывать, но лучше раз попробовать и самому убедится, всем успехов)",5,2gis,,False,,,,0,0,2019-02-13T01:13:59.593608+07:00,,"{'id': '70000001028963932', 'type': 'branch'}","{'id': '16889786', 'reviews_count': 3, 'first_name': 'Андрей Фролов', 'last_name': None, 'name': 'Андрей Фролов', 'provider': '2gis', 'photo_preview_urls': {'1920x': 'https://i3.photo.2gis.com/images/profile/844424968495423_34de_1920x.jpg', '320x': 'https://i3.photo.2gis.com/images/profile/844424968495423_34de_320x.jpg', '640x': 'https://i3.photo.2gis.com/images/profile/844424968495423_34de_640x.jpg', '64x64': 'https://i3.photo.2gis.com/images/profile/844424968495423_34de_64x64.jpg', 'url': 'https://i3.photo.2gis.com/images/profile/844424968495423_34de.jpg'}, 'url': '', 'additional_data': {'email': None}}",,[],"{'status_history': [], 'has_unresolved_complaints': False, 'pin_status': 'none', 'ip': '', 'user_agent': '', 'external_id': None, 'filtered_facts': None, 'is_unrated_permanently': None, 'is_liked': None}",False,True,False
