id,region_id,text,rating,provider,source,is_hidden,hiding_type,hiding_reason,url,likes_count,comments_count,date_created,date_edited,object,user,official_answer,photos,additional_data,on_moderation,is_rated,is_verified
23124440,32,Щёлк щёлк щёлк щёлк щёлк щёлк щёлк щёлк щёлк щёлк щёлк щёлк щёлк щёлк щёлк щёлк щёлк,1,2gis,,False,,,,0,0,2021-08-19T22:55:50.72413+07:00,2021-08-19T22:59:16.338364+07:00,"{'id': '4504127914618265', 'type': 'branch'}","{'id': '23373696', 'reviews_count': 6, 'first_name': 'Uriy Sygrobov', 'last_name': None, 'name': 'Uriy Sygrobov', 'provider': '2gis', 'photo_preview_urls': {'1920x': 'https://i1.photo.2gis.com/images/profile/30258560047870030_9f41_1920x.jpg', '320x': 'https://i1.photo.2gis.com/images/profile/30258560047870030_9f41_320x.jpg', '640x': 'https://i1.photo.2gis.com/images/profile/30258560047870030_9f41_640x.jpg', '64x64': 'https://i1.photo.2gis.com/images/profile/30258560047870030_9f41_64x64.jpg', 'url': 'https://i1.photo.2gis.com/images/profile/30258560047870030_9f41.jpg'}, 'url': '', 'additional_data': {'email': None}}",,[],"{'status_history': [], 'has_unresolved_complaints': False, 'pin_status': 'none', 'ip': '', 'user_agent': '', 'external_id': None, 'filtered_facts': None, 'is_unrated_permanently': None, 'is_liked': None}",False,True,False
24154444,32,"До последнего звали на собеседование. Говорили, вакансии есть, за день созванивались.
По приезду оказалось, что уже ничего не могут предложить. Ехала из далека, осталась на улице. И не я одна.",1,2gis,,False,,,,0,0,2021-10-04T23:56:27.371029+07:00,,"{'id': '4504127908434708', 'type': 'branch'}","{'id': '30509535', 'reviews_count': 1, 'first_name': 'Владислава Тарабановская', 'last_name': None, 'name': 'Владислава Тарабановская', 'provider': '2gis', 'photo_preview_urls': {'1920x': '', '320x': '', '640x': '', '64x64': '', 'url': ''}, 'url': '', 'additional_data': {'email': None}}",,[],"{'status_history': [], 'has_unresolved_complaints': False, 'pin_status': 'none', 'ip': '', 'user_agent': '', 'external_id': None, 'filtered_facts': None, 'is_unrated_permanently': None, 'is_liked': None}",False,True,False
23766966,32,"Приятно иметь дело с профессионалами. У Легис по моему накоплен огромный опыт по оказанию услуг в сфере безопасности. Что пультовая охрана, что физическая или техническая защищенность. Мы сотрудничаем с ними уже давно и они не перестают нас приятно удивлять. Так как постоянно предлагают нестандартные решения или новые наработки в плане безопасности.",5,2gis,,False,,,,1,0,2021-09-17T17:07:43.658411+07:00,,"{'id': '4504127908434708', 'type': 'branch'}","{'id': '30231866', 'reviews_count': 1, 'first_name': 'Матвей Столетов', 'last_name': None, 'name': 'Матвей Столетов', 'provider': '2gis', 'photo_preview_urls': {'1920x': '', '320x': '', '640x': '', '64x64': '', 'url': ''}, 'url': '', 'additional_data': {'email': None}}",,[],"{'status_history': [], 'has_unresolved_complaints': False, 'pin_status': 'none', 'ip': '', 'user_agent': '', 'external_id': None, 'filtered_facts': None, 'is_unrated_permanently': None, 'is_liked': None}",False,True,False
23109765,32,"За пять лет сотрудничества у нас к Легису нет и не было никаких замечаний. Наоборот мы только наблюдали, как они постоянно, в ногу со временем развиваются и повышают свой профессионализм. Особенно это заметно по линии програмного обеспечения.",5,2gis,,False,,,,0,0,2021-08-19T13:28:02.683532+07:00,,"{'id': '4504127908434708', 'type': 'branch'}","{'id': '29728164', 'reviews_count': 1, 'first_name': 'Роман Гончаров', 'last_name': None, 'name': 'Роман Гончаров', 'provider': '2gis', 'photo_preview_urls': {'1920x': '', '320x': '', '640x': '', '64x64': '', 'url': ''}, 'url': '', 'additional_data': {'email': None}}",,[],"{'status_history': [], 'has_unresolved_complaints': False, 'pin_status': 'none', 'ip': '', 'user_agent': '', 'external_id': None, 'filtered_facts': None, 'is_unrated_permanently': None, 'is_liked': None}",False,True,False
22447311,32,Не советую здесь работать.,1,2gis,,False,,,,1,0,2021-07-20T17:13:40.383289+07:00,,"{'id': '4504127908434708', 'type': 'branch'}","{'id': '29254682', 'reviews_count': 1, 'first_name': 'Максим Бах', 'last_name': None, 'name': 'Максим Бах', 'provider': '2gis', 'photo_preview_urls': {'1920x': '', '320x': '', '640x': '', '64x64': '', 'url': ''}, 'url': '', 'additional_data': {'email': None}}",,[],"{'status_history': [], 'has_unresolved_complaints': False, 'pin_status': 'none', 'ip': '', 'user_agent': '', 'external_id': None, 'filtered_facts': None, 'is_unrated_permanently': None, 'is_liked': None}",False,True,False
22385622,32,"Легис очень хорошая компания. Мы заключили с ними договор на пультовую охрану. За все время работы никаких вопросов к ним не возникло. По сигналу тревоги прибывают быстро, согласно установленного времени. Спасибо им за их работу.",5,2gis,,False,,,,1,0,2021-07-17T17:32:23.600813+07:00,,"{'id': '4504127908434708', 'type': 'branch'}","{'id': '29211065', 'reviews_count': 1, 'first_name': 'Николай Мохов', 'last_name': None, 'name': 'Николай Мохов', 'provider': '2gis', 'photo_preview_urls': {'1920x': '', '320x': '', '640x': '', '64x64': '', 'url': ''}, 'url': '', 'additional_data': {'email': None}}",,[],"{'status_history': [], 'has_unresolved_complaints': False, 'pin_status': 'none', 'ip': '', 'user_agent': '', 'external_id': None, 'filtered_facts': None, 'is_unrated_permanently': None, 'is_liked': None}",False,True,False
22364423,32,"Самый ужасный чоп. В легисе кладут на вас.... 4 часа сон. Зарплата минимальная. Тем кто пользуется услугами легиса: у вас на объекте будут три человека в место пяти, усталые, недоспавшие и голодные, сами подумайте что они могут охранять. Для соискателей работы: ребята потратьте время на поиск нормального чоп. 1500 за 18 часов работы не деньги.",1,2gis,,False,,,,2,0,2021-07-16T17:38:32.814939+07:00,,"{'id': '4504127908434708', 'type': 'branch'}","{'id': '29195961', 'reviews_count': 1, 'first_name': 'Maxim Kurbanov', 'last_name': None, 'name': 'Maxim Kurbanov', 'provider': '2gis', 'photo_preview_urls': {'1920x': '', '320x': '', '640x': '', '64x64': '', 'url': ''}, 'url': '', 'additional_data': {'email': None}}",,[],"{'status_history': [], 'has_unresolved_complaints': False, 'pin_status': 'none', 'ip': '', 'user_agent': '', 'external_id': None, 'filtered_facts': None, 'is_unrated_permanently': None, 'is_liked': None}",False,True,False
21664739,32,"Легис разработал очень хорошую систему учета рабочего времени сотрудников по отпечатку пальца. Благодаря этой программе мы всегда можем видеть все ли сотрудники у нас сегодня на работе. Кроме того эта программа позволяет легко начислять им зарплату, так как она связана с программой 1С.",5,2gis,,False,,,,0,0,2021-06-14T16:09:00.767776+07:00,,"{'id': '4504127908434708', 'type': 'branch'}","{'id': '28700582', 'reviews_count': 1, 'first_name': 'Марат Федоров', 'last_name': None, 'name': 'Марат Федоров', 'provider': '2gis', 'photo_preview_urls': {'1920x': '', '320x': '', '640x': '', '64x64': '', 'url': ''}, 'url': '', 'additional_data': {'email': None}}",,[],"{'status_history': [], 'has_unresolved_complaints': False, 'pin_status': 'none', 'ip': '', 'user_agent': '', 'external_id': None, 'filtered_facts': None, 'is_unrated_permanently': None, 'is_liked': None}",False,True,False
20546053,32,"Если у Вас есть необходимость установить у себя на объекте пропускную систему или систему охраны, то можете смело обращаться в Легис. Работают ребята просто отлично. Во первых быстро, а во вторых профессионально и аккуратно.",5,2gis,,False,,,,0,0,2021-04-20T16:41:45.303079+07:00,,"{'id': '4504127908434708', 'type': 'branch'}","{'id': '27900893', 'reviews_count': 1, 'first_name': 'Стас Надеждин', 'last_name': None, 'name': 'Стас Надеждин', 'provider': '2gis', 'photo_preview_urls': {'1920x': '', '320x': '', '640x': '', '64x64': '', 'url': ''}, 'url': '', 'additional_data': {'email': None}}",,[],"{'status_history': [], 'has_unresolved_complaints': False, 'pin_status': 'none', 'ip': '', 'user_agent': '', 'external_id': None, 'filtered_facts': None, 'is_unrated_permanently': None, 'is_liked': None}",False,True,False
19914559,32,Хороший ЧОП с командой профессионалов. Пультовая охрана у них на высоте. В своей работе используют новейшее беспроводное оборудование. По сигналам тревоги реагируют быстро и оперативно решают все вопросы.,5,2gis,,False,,,,0,0,2021-03-20T17:01:18.379674+07:00,,"{'id': '4504127908434708', 'type': 'branch'}","{'id': '27316187', 'reviews_count': 3, 'first_name': 'Анатолий Рагозин', 'last_name': None, 'name': 'Анатолий Рагозин', 'provider': '2gis', 'photo_preview_urls': {'1920x': '', '320x': '', '640x': '', '64x64': '', 'url': ''}, 'url': '', 'additional_data': {'email': None}}",,[],"{'status_history': [], 'has_unresolved_complaints': False, 'pin_status': 'none', 'ip': '', 'user_agent': '', 'external_id': None, 'filtered_facts': None, 'is_unrated_permanently': None, 'is_liked': None}",False,True,False
18878795,32,"Мы убрали со своего объекта старый ЧОП и заключили договор с Легис. На то что бы выстроить всю работу на 100% у них ушла всего лишь неделя. За это время они разобрались со всеми нюансами и нашими требованиями к их работе. Также они внедрили все свои внутренние на работки по линии охраны и работа пошла, как надо. Большое им спасибо.",5,2gis,,False,,,,0,0,2021-01-25T19:03:01.812782+07:00,,"{'id': '4504127908434708', 'type': 'branch'}","{'id': '26541227', 'reviews_count': 2, 'first_name': 'Александр Молов', 'last_name': None, 'name': 'Александр Молов', 'provider': '2gis', 'photo_preview_urls': {'1920x': '', '320x': '', '640x': '', '64x64': '', 'url': ''}, 'url': '', 'additional_data': {'email': None}}",,[],"{'status_history': [], 'has_unresolved_complaints': False, 'pin_status': 'none', 'ip': '', 'user_agent': '', 'external_id': None, 'filtered_facts': None, 'is_unrated_permanently': None, 'is_liked': None}",False,True,False
18094158,32,Работаем с Легис по пультовой охране. За 6 месяцев вызывали их несколько раз. Прибывали быстро и оперативно разбирались во всех вопросах. Одним словом молодцы.,5,2gis,,False,,,,0,0,2020-12-08T16:47:53.098929+07:00,,"{'id': '4504127908434708', 'type': 'branch'}","{'id': '26070047', 'reviews_count': 1, 'first_name': 'Стас Квашнин', 'last_name': None, 'name': 'Стас Квашнин', 'provider': '2gis', 'photo_preview_urls': {'1920x': '', '320x': '', '640x': '', '64x64': '', 'url': ''}, 'url': '', 'additional_data': {'email': None}}",,[],"{'status_history': [], 'has_unresolved_complaints': False, 'pin_status': 'none', 'ip': '', 'user_agent': '', 'external_id': None, 'filtered_facts': None, 'is_unrated_permanently': None, 'is_liked': None}",False,True,False
16345820,32,"Чоп Легис. Что скажу со 100% эта зарплата,свое вы получите точно и при увольнение полный расчет. Большой выбор объектов и если у тебя не сложилось на объекте (не сошлись характером со старшими) кадровики всегда подберут другой объект по вашим требованиям.",4,2gis,,False,,,,0,0,2020-08-27T18:05:35.733847+07:00,,"{'id': '4504127908434708', 'type': 'branch'}","{'id': '24492139', 'reviews_count': 4, 'first_name': 'Михаил Семенов', 'last_name': None, 'name': 'Михаил Семенов', 'provider': '2gis', 'photo_preview_urls': {'1920x': 'https://i1.photo.2gis.com/images/profile/30258560050462275_4811_1920x.jpg', '320x': 'https://i1.photo.2gis.com/images/profile/30258560050462275_4811_320x.jpg', '640x': 'https://i1.photo.2gis.com/images/profile/30258560050462275_4811_640x.jpg', '64x64': 'https://i1.photo.2gis.com/images/profile/30258560050462275_4811_64x64.jpg', 'url': 'https://i1.photo.2gis.com/images/profile/30258560050462275_4811.jpg'}, 'url': '', 'additional_data': {'email': None}}",,[],"{'status_history': [], 'has_unresolved_complaints': False, 'pin_status': 'none', 'ip': '', 'user_agent': '', 'external_id': None, 'filtered_facts': None, 'is_unrated_permanently': None, 'is_liked': None}",False,True,False
15413182,32,"Рекомендуем Легис, как надежную компанию. Мы заключили с ними договор на пультовую охрану. За два с половиной года нашего сотрудничества, качество работы не только не ухудшилось, а наоборот повысилось, так как на сегодняшний день они стали применять свои технические новинки. За что им большое спасибо.",5,2gis,,False,,,,0,0,2020-06-21T18:48:48.76829+07:00,,"{'id': '4504127908434708', 'type': 'branch'}","{'id': '23788473', 'reviews_count': 1, 'first_name': 'Денис', 'last_name': None, 'name': 'Денис', 'provider': '2gis', 'photo_preview_urls': {'1920x': '', '320x': '', '640x': '', '64x64': '', 'url': ''}, 'url': '', 'additional_data': {'email': None}}",,[],"{'status_history': [], 'has_unresolved_complaints': False, 'pin_status': 'none', 'ip': '', 'user_agent': '', 'external_id': None, 'filtered_facts': None, 'is_unrated_permanently': None, 'is_liked': None}",False,True,False
14805931,32,"Компания Легис установила нам пультовую охрану. Сделано это было достаточно оперативно и на высшем уровне. Сейчас мы сотрудничаем с ними и не знаем никаких проблем. По сигналу тревоги на место пребывают быстро, возникающие вопросы решаются без проблем.",5,2gis,,False,,,,0,0,2020-04-20T17:58:45.170262+07:00,,"{'id': '4504127908434708', 'type': 'branch'}","{'id': '23211523', 'reviews_count': 1, 'first_name': 'Александр Новиков', 'last_name': None, 'name': 'Александр Новиков', 'provider': '2gis', 'photo_preview_urls': {'1920x': 'https://i1.photo.2gis.com/images/profile/30258560047451822_d537_1920x.jpg', '320x': 'https://i1.photo.2gis.com/images/profile/30258560047451822_d537_320x.jpg', '640x': 'https://i1.photo.2gis.com/images/profile/30258560047451822_d537_640x.jpg', '64x64': 'https://i1.photo.2gis.com/images/profile/30258560047451822_d537_64x64.jpg', 'url': 'https://i1.photo.2gis.com/images/profile/30258560047451822_d537.jpg'}, 'url': '', 'additional_data': {'email': None}}",,[],"{'status_history': [], 'has_unresolved_complaints': False, 'pin_status': 'none', 'ip': '', 'user_agent': '', 'external_id': None, 'filtered_facts': None, 'is_unrated_permanently': None, 'is_liked': None}",False,True,False
14522573,32,Сейчас контроль за рабочим временем сотрудников с помощью биометрики стал обычным делом. Вот и мы установили себе эту программу с помощью компании Легис. Большое спасибо ребятам за такую услугу. Во первых учет рабочего времени стал гораздо проще и более точным. Во вторых мы получили реальную экономию при использовании данной программы. Рекомендуем!,5,2gis,,False,,,,0,0,2020-03-20T17:30:49.077087+07:00,,"{'id': '4504127908434708', 'type': 'branch'}","{'id': '22944908', 'reviews_count': 1, 'first_name': 'Алексей Смирнов', 'last_name': None, 'name': 'Алексей Смирнов', 'provider': '2gis', 'photo_preview_urls': {'1920x': 'https://i1.photo.2gis.com/images/profile/30258560046781061_6b10_1920x.jpg', '320x': 'https://i1.photo.2gis.com/images/profile/30258560046781061_6b10_320x.jpg', '640x': 'https://i1.photo.2gis.com/images/profile/30258560046781061_6b10_640x.jpg', '64x64': 'https://i1.photo.2gis.com/images/profile/30258560046781061_6b10_64x64.jpg', 'url': 'https://i1.photo.2gis.com/images/profile/30258560046781061_6b10.jpg'}, 'url': '', 'additional_data': {'email': None}}",,[],"{'status_history': [], 'has_unresolved_complaints': False, 'pin_status': 'none', 'ip': '', 'user_agent': '', 'external_id': None, 'filtered_facts': None, 'is_unrated_permanently': None, 'is_liked': None}",False,True,False
13902940,32,"Ребята с технического отдела в Легисе просто молодцы. Когда мы решили установить у себя в компании систему видеонаблюдения, то начали прорабатывать данный вопрос сразу с несколькими фирмами и по результатам у нас было готово техническое задание. Но наши компаньоны посоветовали нам обратиться в Легис. Ребята предложили нам более технически грамотные решения, которые позволили на порядок сэкономить запланированный бюджет.",5,2gis,,False,,,,0,0,2020-02-11T19:15:16.165918+07:00,,"{'id': '4504127908434708', 'type': 'branch'}","{'id': '22480477', 'reviews_count': 1, 'first_name': 'Вадим Чесноков', 'last_name': None, 'name': 'Вадим Чесноков', 'provider': '2gis', 'photo_preview_urls': {'1920x': '', '320x': '', '640x': '', '64x64': '', 'url': ''}, 'url': '', 'additional_data': {'email': None}}",,[],"{'status_history': [], 'has_unresolved_complaints': False, 'pin_status': 'none', 'ip': '', 'user_agent': '', 'external_id': None, 'filtered_facts': None, 'is_unrated_permanently': None, 'is_liked': None}",False,True,False
13031335,32,"Про Легис мы можем сказать только одно, это очень хорошая компания. Она постоянно развивается и совершенствуется. Для этого у них создан целый IT отдел, который постоянно разрабатывает новые программы, позволяющие управлять различными бизнес процессами на охраняемых объектах.",5,2gis,,False,,,,1,0,2019-12-13T17:34:05.119979+07:00,,"{'id': '4504127908434708', 'type': 'branch'}","{'id': '21687828', 'reviews_count': 1, 'first_name': 'Дмитрий', 'last_name': None, 'name': 'Дмитрий', 'provider': '2gis', 'photo_preview_urls': {'1920x': '', '320x': '', '640x': '', '64x64': '', 'url': ''}, 'url': '', 'additional_data': {'email': None}}",,[],"{'status_history': [], 'has_unresolved_complaints': False, 'pin_status': 'none', 'ip': '', 'user_agent': '', 'external_id': None, 'filtered_facts': None, 'is_unrated_permanently': None, 'is_liked': None}",False,True,False
12768172,32,"Мы сотрудничаем с ЛЕГИС по многим направлениям. Больше всего нам нравится в них то, что они не стоят на месте, а постоянно используют в своей работе современные разработки по линии IT технологий. Контролируют нахождение сотрудников на объекте, качество выполненных работ, формируют отчеты и т.д. Самое главное, что все это происходит удаленно и в режиме реального времени.",5,2gis,,False,,,,0,0,2019-11-25T21:51:17.795764+07:00,,"{'id': '4504127908434708', 'type': 'branch'}","{'id': '21465752', 'reviews_count': 1, 'first_name': 'Даниил Симанов', 'last_name': None, 'name': 'Даниил Симанов', 'provider': '2gis', 'photo_preview_urls': {'1920x': '', '320x': '', '640x': '', '64x64': '', 'url': ''}, 'url': '', 'additional_data': {'email': None}}",,[],"{'status_history': [], 'has_unresolved_complaints': False, 'pin_status': 'none', 'ip': '', 'user_agent': '', 'external_id': None, 'filtered_facts': None, 'is_unrated_permanently': None, 'is_liked': None}",False,True,False
12366204,32,"У нас договор с Легис на обслуживание системы видеонаблюдения. Здесь мы получили не только высококлассных специалистов, которые своевременно и качественно выполняют свою работу, но и профессионалов в вопросах безопасности.",5,2gis,,False,,,,0,0,2019-10-28T22:56:40.309763+07:00,,"{'id': '4504127908434708', 'type': 'branch'}","{'id': '21123015', 'reviews_count': 3, 'first_name': 'Игорь Наумов', 'last_name': None, 'name': 'Игорь Наумов', 'provider': '2gis', 'photo_preview_urls': {'1920x': 'https://i0.photo.2gis.com/images/profile/844424968421976_4c3f_1920x.jpg', '320x': 'https://i0.photo.2gis.com/images/profile/844424968421976_4c3f_320x.jpg', '640x': 'https://i0.photo.2gis.com/images/profile/844424968421976_4c3f_640x.jpg', '64x64': 'https://i0.photo.2gis.com/images/profile/844424968421976_4c3f_64x64.jpg', 'url': 'https://i0.photo.2gis.com/images/profile/844424968421976_4c3f.jpg'}, 'url': '', 'additional_data': {'email': None}}",,[],"{'status_history': [], 'has_unresolved_complaints': False, 'pin_status': 'none', 'ip': '', 'user_agent': '', 'external_id': None, 'filtered_facts': None, 'is_unrated_permanently': None, 'is_liked': None}",False,True,False
11556231,32,"Работаем с ребятами из легиса по биометрическому учету рабочего времени. Давно об этом думали, но было множество «НО». Искали компанию, что самостоятельно этим занимается, а не через десяток подрядчиков. Все получилось реализовать, все работает, ребята всегда на связи в случае вопросов.",5,2gis,,False,,,,0,0,2019-09-11T18:43:16.207829+07:00,,"{'id': '4504127908434708', 'type': 'branch'}","{'id': '20474518', 'reviews_count': 3, 'first_name': 'Элина Моргулина', 'last_name': None, 'name': 'Элина Моргулина', 'provider': '2gis', 'photo_preview_urls': {'1920x': 'https://i3.photo.2gis.com/images/profile/844424968426932_1f0e_1920x.jpg', '320x': 'https://i3.photo.2gis.com/images/profile/844424968426932_1f0e_320x.jpg', '640x': 'https://i3.photo.2gis.com/images/profile/844424968426932_1f0e_640x.jpg', '64x64': 'https://i3.photo.2gis.com/images/profile/844424968426932_1f0e_64x64.jpg', 'url': 'https://i3.photo.2gis.com/images/profile/844424968426932_1f0e.jpg'}, 'url': '', 'additional_data': {'email': None}}",,[],"{'status_history': [], 'has_unresolved_complaints': False, 'pin_status': 'none', 'ip': '', 'user_agent': '', 'external_id': None, 'filtered_facts': None, 'is_unrated_permanently': None, 'is_liked': None}",False,True,False
