id,region_id,text,rating,provider,source,is_hidden,hiding_type,hiding_reason,url,likes_count,comments_count,date_created,date_edited,object,user,official_answer,photos,additional_data,on_moderation,is_rated,is_verified
19963659,32,"Я уже совсем забыла с этой компанией, что такое - спокойная ночь! У них постоянно проблемы с оборудованием! У. Аня трижды в этом месяце была сработка ночью ! Приходилось приезжают и проверять все от в прядке ! Каждый раз были проблемы с неисправностью оборудования! Ко мне дважды приезжал инженер, говорил , что все настроил и все уже должно работать отлично, но через 2-4 недели все снова выходилось из строя! Вот в это. Случае я и задумалась  купить такую же систему  , но у другого чопа!",1,flamp,,False,,,https://flamp.ru/r/4504127908456925/6810464,0,0,2021-03-23T05:22:29.0+07:00,,"{'id': '4504127908456925', 'type': 'branch'}","{'id': '4216960', 'reviews_count': 1, 'first_name': 'xabijo3887', 'last_name': None, 'name': 'xabijo3887', 'provider': 'flamp', 'photo_preview_urls': {'1920x': 'https://cdn1.flamp.ru/default-avatar-m_1920.png', '320x': 'https://cdn1.flamp.ru/default-avatar-m_320.png', '640x': 'https://cdn1.flamp.ru/default-avatar-m_640.png', '64x64': 'https://cdn1.flamp.ru/default-avatar-m_64_64.png', 'url': 'https://cdn1.flamp.ru/default-avatar-m.png'}, 'url': 'http://flamp.ru/user4216960', 'additional_data': {'email': None}}",,[],"{'status_history': [], 'has_unresolved_complaints': False, 'pin_status': 'none', 'ip': '', 'user_agent': '', 'external_id': '6810464', 'filtered_facts': None, 'is_unrated_permanently': None, 'is_liked': None}",False,True,False
19962639,32,"Мне так «нравится» работа данной компании. Звоню, мне говорят что будет одна стоимость установки. Приезжает инженер устанавливать говорит другую. Я в недоумении не понимаю что мне делать, звоню уточнить этот вопрос. А мне говорят там изначальную. В итоге я естественно не стала ничего оплачивать. Что за абсурд?",1,flamp,,False,,,https://flamp.ru/r/4504127908456925/6810392,0,0,2021-03-23T02:15:54.0+07:00,,"{'id': '4504127908456925', 'type': 'branch'}","{'id': '4216863', 'reviews_count': 1, 'first_name': 'bitaymdspn', 'last_name': None, 'name': 'bitaymdspn', 'provider': 'flamp', 'photo_preview_urls': {'1920x': 'https://cdn1.flamp.ru/default-avatar-m_1920.png', '320x': 'https://cdn1.flamp.ru/default-avatar-m_320.png', '640x': 'https://cdn1.flamp.ru/default-avatar-m_640.png', '64x64': 'https://cdn1.flamp.ru/default-avatar-m_64_64.png', 'url': 'https://cdn1.flamp.ru/default-avatar-m.png'}, 'url': 'http://flamp.ru/user4216863', 'additional_data': {'email': None}}",,[],"{'status_history': [], 'has_unresolved_complaints': False, 'pin_status': 'none', 'ip': '', 'user_agent': '', 'external_id': '6810392', 'filtered_facts': None, 'is_unrated_permanently': None, 'is_liked': None}",False,True,False
19896113,32,"Очень некомпетентные сотрудники охраны! Мне нахамили! Я руководитель, как вообще они себе такое позволяют! Я своих бы поувольнял , если бы спорили с клиентами! И к тому же мне не нравится , что у них цены очень разные ! У каждого сотрудника как будто свой личный прайс! И собственно из-за того, что я начал спорить про цены мне и нахамили!",1,flamp,,False,,,https://flamp.ru/r/4504127908456925/6802925,0,0,2021-03-19T18:07:40.0+07:00,,"{'id': '4504127908456925', 'type': 'branch'}","{'id': '4212080', 'reviews_count': 1, 'first_name': 'loweye8940', 'last_name': None, 'name': 'loweye8940', 'provider': 'flamp', 'photo_preview_urls': {'1920x': 'https://cdn1.flamp.ru/default-avatar-m_1920.png', '320x': 'https://cdn1.flamp.ru/default-avatar-m_320.png', '640x': 'https://cdn1.flamp.ru/default-avatar-m_640.png', '64x64': 'https://cdn1.flamp.ru/default-avatar-m_64_64.png', 'url': 'https://cdn1.flamp.ru/default-avatar-m.png'}, 'url': 'http://flamp.ru/user4212080', 'additional_data': {'email': None}}",,[],"{'status_history': [], 'has_unresolved_complaints': False, 'pin_status': 'none', 'ip': '', 'user_agent': '', 'external_id': '6802925', 'filtered_facts': None, 'is_unrated_permanently': None, 'is_liked': None}",False,True,False
19657353,32,"Сначала подключили магазин к сигнализации от ООО Спецмонтаж, теперь подключаем дом. Сотрудники — умнички, по всем вопросам не было задержек. Сигнализационную технику установили нормально, потом добавляли оборудование и тоже без проблем. Уже три раза срабатывала сигнализация, приезжали минут за 10, разбирались. Нам понравился их подход и теперь дом тоже ставим под их охрану! Рекомендую!",5,2gis,,False,,,,0,0,2021-03-07T19:27:01.04999+07:00,,"{'id': '4504127908456925', 'type': 'branch'}","{'id': '27261473', 'reviews_count': 4, 'first_name': 'Анна Михайлова', 'last_name': None, 'name': 'Анна Михайлова', 'provider': '2gis', 'photo_preview_urls': {'1920x': '', '320x': '', '640x': '', '64x64': '', 'url': ''}, 'url': '', 'additional_data': {'email': None}}",,[],"{'status_history': [], 'has_unresolved_complaints': False, 'pin_status': 'none', 'ip': '', 'user_agent': '', 'external_id': None, 'filtered_facts': None, 'is_unrated_permanently': None, 'is_liked': None}",False,True,False
19657218,32,"ООО Спецмонтаж — компания, которая меня приятно удивила. И ценами, и своим подходом. Техники профессиональные, установили сигнализацию на офис быстро, все делали строго, без лишних вопросов, учитывая мои требования. Подробно рассказали о том, как функционирует сигнализация, протестировали ее. Резюмируя, система работает уже больше полугода: ложных срабатываний нет, я довольна. Обслуживание заказывали здесь же.",5,flamp,,False,,,https://flamp.ru/r/4504127908456925/6775276,0,0,2021-03-07T19:20:23.0+07:00,2021-03-07T19:20:50.0+07:00,"{'id': '4504127908456925', 'type': 'branch'}","{'id': '4189912', 'reviews_count': 12, 'first_name': 'Ирина', 'last_name': None, 'name': 'Ирина', 'provider': 'flamp', 'photo_preview_urls': {'1920x': 'https://cdn1.flamp.ru/c9e3aeb0961481f23a0122705825de3d_1920.jpg', '320x': 'https://cdn1.flamp.ru/c9e3aeb0961481f23a0122705825de3d_320.jpg', '640x': 'https://cdn1.flamp.ru/c9e3aeb0961481f23a0122705825de3d_640.jpg', '64x64': 'https://cdn1.flamp.ru/c9e3aeb0961481f23a0122705825de3d_64_64.jpg', 'url': 'https://cdn1.flamp.ru/c9e3aeb0961481f23a0122705825de3d.jpg'}, 'url': 'http://flamp.ru/user4189912', 'additional_data': {'email': None}}",,[],"{'status_history': [], 'has_unresolved_complaints': False, 'pin_status': 'none', 'ip': '', 'user_agent': '', 'external_id': '6775276', 'filtered_facts': None, 'is_unrated_permanently': None, 'is_liked': None}",False,True,False
19447661,32,"Третью неделю жду когда объект выведут на пульт. На мои звонки в компанию отвечают что информация передана в смежный отдел и будет обработана. Так уже 3 неделю. И регламента я так понимаю по постановке на учёт у них нет, я заплатил деньги а охрану не вижу. Терпеть буду до конца недели!",1,flamp,,False,,,https://flamp.ru/r/4504127908456925/6750259,0,0,2021-02-24T19:32:00.0+07:00,,"{'id': '4504127908456925', 'type': 'branch'}","{'id': '4185296', 'reviews_count': 1, 'first_name': 'Арслан', 'last_name': None, 'name': 'Арслан', 'provider': 'flamp', 'photo_preview_urls': {'1920x': 'https://cdn1.flamp.ru/default-avatar-m_1920.png', '320x': 'https://cdn1.flamp.ru/default-avatar-m_320.png', '640x': 'https://cdn1.flamp.ru/default-avatar-m_640.png', '64x64': 'https://cdn1.flamp.ru/default-avatar-m_64_64.png', 'url': 'https://cdn1.flamp.ru/default-avatar-m.png'}, 'url': 'http://flamp.ru/user4185296', 'additional_data': {'email': None}}",,[],"{'status_history': [], 'has_unresolved_complaints': False, 'pin_status': 'none', 'ip': '', 'user_agent': '', 'external_id': '6750259', 'filtered_facts': None, 'is_unrated_permanently': None, 'is_liked': None}",False,True,False
19432034,32,"Решил подключить кафе к охране. Приехал установщик. Он был какой-то странный. Суетился, нервничал . Долго возился. Проверить вызов забыл. На вопросы ответить не мог.  На это все я еще закрыл глаза. Но когда сработала сигнализация и охрана приехала через 40 мин, это уже слишком. Не понятно а для чего я подключался? Деньги у меня лишние? Договор сразу разорвал с данной компанией.",1,flamp,,False,,,https://flamp.ru/r/4504127908456925/6748171,0,0,2021-02-23T22:58:48.0+07:00,,"{'id': '4504127908456925', 'type': 'branch'}","{'id': '4183084', 'reviews_count': 2, 'first_name': 'ice2apipgm', 'last_name': None, 'name': 'ice2apipgm', 'provider': 'flamp', 'photo_preview_urls': {'1920x': 'https://cdn1.flamp.ru/default-avatar-m_1920.png', '320x': 'https://cdn1.flamp.ru/default-avatar-m_320.png', '640x': 'https://cdn1.flamp.ru/default-avatar-m_640.png', '64x64': 'https://cdn1.flamp.ru/default-avatar-m_64_64.png', 'url': 'https://cdn1.flamp.ru/default-avatar-m.png'}, 'url': 'http://flamp.ru/user4183084', 'additional_data': {'email': None}}",,[],"{'status_history': [], 'has_unresolved_complaints': False, 'pin_status': 'none', 'ip': '', 'user_agent': '', 'external_id': '6748171', 'filtered_facts': None, 'is_unrated_permanently': None, 'is_liked': None}",False,True,False
19412041,32,"Подключил коттедж к охране. При подключении оплату существенно завысили. Реагирования вообще долгое. На такое реагирования совсем не приходится. Мало того что поздно приехали, так ещё и хамят. У них что никакой инструкции нет? Их не учат как с клиентами разговаривать надо. Машины старые, ломаются. А я не должен из-за этого страдать. В компании происходит ан бардак. Расторг договор.",1,flamp,,False,,,https://flamp.ru/r/4504127908456925/6745947,0,0,2021-02-22T20:35:47.0+07:00,,"{'id': '4504127908456925', 'type': 'branch'}","{'id': '4183084', 'reviews_count': 2, 'first_name': 'ice2apipgm', 'last_name': None, 'name': 'ice2apipgm', 'provider': 'flamp', 'photo_preview_urls': {'1920x': 'https://cdn1.flamp.ru/default-avatar-m_1920.png', '320x': 'https://cdn1.flamp.ru/default-avatar-m_320.png', '640x': 'https://cdn1.flamp.ru/default-avatar-m_640.png', '64x64': 'https://cdn1.flamp.ru/default-avatar-m_64_64.png', 'url': 'https://cdn1.flamp.ru/default-avatar-m.png'}, 'url': 'http://flamp.ru/user4183084', 'additional_data': {'email': None}}",,[],"{'status_history': [], 'has_unresolved_complaints': False, 'pin_status': 'none', 'ip': '', 'user_agent': '', 'external_id': '6745947', 'filtered_facts': None, 'is_unrated_permanently': None, 'is_liked': None}",False,True,False
19399662,32,"Уже сколько дней не могу достучаться до компании. Не работает оборудование, я его снял, компания даже не позвонила, у них ведь должно отображаться что оборудование не функционирует. Пытаюсь как-то дозвониться чтобы отправили мастера на починку, но естественно трубки не берут, и мастера видимо не будет, раз даже не звонят о том что сигнал не проходит. Наверное деньги плачу и этого хватит, как считает компания!",1,flamp,,False,,,https://flamp.ru/r/4504127908456925/6744498,0,0,2021-02-22T03:12:42.0+07:00,,"{'id': '4504127908456925', 'type': 'branch'}","{'id': '4182333', 'reviews_count': 1, 'first_name': 'Семён', 'last_name': None, 'name': 'Семён', 'provider': 'flamp', 'photo_preview_urls': {'1920x': 'https://cdn1.flamp.ru/default-avatar-m_1920.png', '320x': 'https://cdn1.flamp.ru/default-avatar-m_320.png', '640x': 'https://cdn1.flamp.ru/default-avatar-m_640.png', '64x64': 'https://cdn1.flamp.ru/default-avatar-m_64_64.png', 'url': 'https://cdn1.flamp.ru/default-avatar-m.png'}, 'url': 'http://flamp.ru/user4182333', 'additional_data': {'email': None}}",,[],"{'status_history': [], 'has_unresolved_complaints': False, 'pin_status': 'none', 'ip': '', 'user_agent': '', 'external_id': '6744498', 'filtered_facts': None, 'is_unrated_permanently': None, 'is_liked': None}",False,True,False
19320860,32,"Подключил впервые в своей квартире сигнализацию. Позже планировали установить и в офисе. Но компания не понравилась, не надёжная. Объяснить ничего не могут, надо с них вытягивать. А группа быстрого реагирования приехали через пол часа. Вид у них как у бомжей, машина грязная. Это же лицо компании. На первом этапе отбивают все желание с ними работать.",1,flamp,,False,,,https://flamp.ru/r/4504127908456925/6735388,0,0,2021-02-18T02:22:07.0+07:00,,"{'id': '4504127908456925', 'type': 'branch'}","{'id': '4177430', 'reviews_count': 1, 'first_name': '6hqedd7na9', 'last_name': None, 'name': '6hqedd7na9', 'provider': 'flamp', 'photo_preview_urls': {'1920x': 'https://cdn1.flamp.ru/default-avatar-m_1920.png', '320x': 'https://cdn1.flamp.ru/default-avatar-m_320.png', '640x': 'https://cdn1.flamp.ru/default-avatar-m_640.png', '64x64': 'https://cdn1.flamp.ru/default-avatar-m_64_64.png', 'url': 'https://cdn1.flamp.ru/default-avatar-m.png'}, 'url': 'http://flamp.ru/user4177430', 'additional_data': {'email': None}}",,[],"{'status_history': [], 'has_unresolved_complaints': False, 'pin_status': 'none', 'ip': '', 'user_agent': '', 'external_id': '6735388', 'filtered_facts': None, 'is_unrated_permanently': None, 'is_liked': None}",False,True,False
19309014,32,"Установили оборудование, а оно оказалось б/у , я такой скандал им устроила! Это что за обман ! Как так можно с клиентами работать! Берут деньги за новое , а привозят старое! Ничего менять не хотят! Сказали, что когда устанавливали никаких претензий не было, поэтому менять они ничего не будут!",1,flamp,,False,,,https://flamp.ru/r/4504127908456925/6733787,0,0,2021-02-17T16:02:39.0+07:00,,"{'id': '4504127908456925', 'type': 'branch'}","{'id': '4176376', 'reviews_count': 1, 'first_name': 'gocicaw149', 'last_name': None, 'name': 'gocicaw149', 'provider': 'flamp', 'photo_preview_urls': {'1920x': 'https://cdn1.flamp.ru/default-avatar-m_1920.png', '320x': 'https://cdn1.flamp.ru/default-avatar-m_320.png', '640x': 'https://cdn1.flamp.ru/default-avatar-m_640.png', '64x64': 'https://cdn1.flamp.ru/default-avatar-m_64_64.png', 'url': 'https://cdn1.flamp.ru/default-avatar-m.png'}, 'url': 'http://flamp.ru/user4176376', 'additional_data': {'email': None}}",,[],"{'status_history': [], 'has_unresolved_complaints': False, 'pin_status': 'none', 'ip': '', 'user_agent': '', 'external_id': '6733787', 'filtered_facts': None, 'is_unrated_permanently': None, 'is_liked': None}",False,True,False
19258331,32,"Первоначально перед установкой датчиков домой, я предупредила что это далековато от города и ехать не 5 минут. Мне сказали, что машин с охраной много и гарантировали максимум 10 минут. На бумаге конечно прописано 20, во что я тоже не сильно поверила. Но подключила и первый же вызов пробный был провальным, потому что приехали за 45 минут и как оказалось деньги компенсацией о которой говорилось, не выплачивают если до этого в доме не было описи вещей и ценностей. Отлично, но об этом даже мелкими буквами не указано, это простой обман и мошенничество.",1,flamp,,False,,,https://flamp.ru/r/4504127908456925/6727386,0,0,2021-02-14T23:17:20.0+07:00,,"{'id': '4504127908456925', 'type': 'branch'}","{'id': '4172753', 'reviews_count': 1, 'first_name': 'Алиса', 'last_name': None, 'name': 'Алиса', 'provider': 'flamp', 'photo_preview_urls': {'1920x': 'https://cdn1.flamp.ru/default-avatar-m_1920.png', '320x': 'https://cdn1.flamp.ru/default-avatar-m_320.png', '640x': 'https://cdn1.flamp.ru/default-avatar-m_640.png', '64x64': 'https://cdn1.flamp.ru/default-avatar-m_64_64.png', 'url': 'https://cdn1.flamp.ru/default-avatar-m.png'}, 'url': 'http://flamp.ru/user4172753', 'additional_data': {'email': None}}",,[],"{'status_history': [], 'has_unresolved_complaints': False, 'pin_status': 'none', 'ip': '', 'user_agent': '', 'external_id': '6727386', 'filtered_facts': None, 'is_unrated_permanently': None, 'is_liked': None}",False,True,False
19240933,32,"По телефону девушка, которая ничего не понимает в ассортименте компании, уверяла, что у них очень качественные камеры видеонаблюдения, якобы японские. Заказала комплект. На месте увидела, что это китайское качество, причем цены завышены у них. Высокий риск брака. Отказалась от установки, выставили счёт за выезд мастера.",1,flamp,,False,,,https://flamp.ru/r/4504127908456925/6725554,0,0,2021-02-14T00:54:33.0+07:00,,"{'id': '4504127908456925', 'type': 'branch'}","{'id': '4171818', 'reviews_count': 1, 'first_name': 'Сильвия', 'last_name': None, 'name': 'Сильвия', 'provider': 'flamp', 'photo_preview_urls': {'1920x': 'https://cdn1.flamp.ru/default-avatar-m_1920.png', '320x': 'https://cdn1.flamp.ru/default-avatar-m_320.png', '640x': 'https://cdn1.flamp.ru/default-avatar-m_640.png', '64x64': 'https://cdn1.flamp.ru/default-avatar-m_64_64.png', 'url': 'https://cdn1.flamp.ru/default-avatar-m.png'}, 'url': 'http://flamp.ru/user4171818', 'additional_data': {'email': None}}",,[],"{'status_history': [], 'has_unresolved_complaints': False, 'pin_status': 'none', 'ip': '', 'user_agent': '', 'external_id': '6725554', 'filtered_facts': None, 'is_unrated_permanently': None, 'is_liked': None}",False,True,False
19199098,32,СпецМонтаж здорово выручает в плане безопасности бизнеса. Доверил свою фирму и теперь спокоен. Охранные услуги на высоком уровне. Нормальное обслуживание. Очень доступные цены. Оборудование работает безотказно. Постоянный мониторинг и оповещение. Удобное мобильное приложение с полезными функциями и возможностью дистанционного управления.,5,2gis,,False,,,,0,0,2021-02-11T21:26:32.063555+07:00,,"{'id': '4504127908456925', 'type': 'branch'}","{'id': '25691468', 'reviews_count': 3, 'first_name': 'Алексей Туркин', 'last_name': None, 'name': 'Алексей Туркин', 'provider': '2gis', 'photo_preview_urls': {'1920x': '', '320x': '', '640x': '', '64x64': '', 'url': ''}, 'url': '', 'additional_data': {'email': None}}",,[],"{'status_history': [], 'has_unresolved_complaints': False, 'pin_status': 'none', 'ip': '', 'user_agent': '', 'external_id': None, 'filtered_facts': None, 'is_unrated_permanently': None, 'is_liked': None}",False,True,False
19182832,32,"Менеджеры не разбираются в своем товаре и пытаются продать его любым способом, нагло врут. Пожарная сигнализация, которую мне поставили, никак не соответствует ГОСТу, хотя клялись, что соответствует. Потерял время, нервы и деньги. Ещё и от МЧС предупреждение.",1,flamp,,False,,,https://flamp.ru/r/4504127908456925/6718934,0,0,2021-02-11T00:31:11.0+07:00,,"{'id': '4504127908456925', 'type': 'branch'}","{'id': '4168206', 'reviews_count': 1, 'first_name': 'Константин', 'last_name': None, 'name': 'Константин', 'provider': 'flamp', 'photo_preview_urls': {'1920x': 'https://cdn1.flamp.ru/default-avatar-m_1920.png', '320x': 'https://cdn1.flamp.ru/default-avatar-m_320.png', '640x': 'https://cdn1.flamp.ru/default-avatar-m_640.png', '64x64': 'https://cdn1.flamp.ru/default-avatar-m_64_64.png', 'url': 'https://cdn1.flamp.ru/default-avatar-m.png'}, 'url': 'http://flamp.ru/user4168206', 'additional_data': {'email': None}}",,[],"{'status_history': [], 'has_unresolved_complaints': False, 'pin_status': 'none', 'ip': '', 'user_agent': '', 'external_id': '6718934', 'filtered_facts': None, 'is_unrated_permanently': None, 'is_liked': None}",False,True,False
19161733,32,"Специалистов по охране наверное с улицы просто набирают или может плохо их обучают. Но из трёх менеджеров с кем я разговаривала по поводу охраны квартиры, ни один нормально не смог мне объяснить как работает система, во сколько мне это обойдется и какие услуги предоставляет компания.  Уж и не знаю что думать про саму компанию, если сотрудники так плохо владеют информацией, мое первое впечатление не очень про фирму конечно.",1,flamp,,False,,,https://flamp.ru/r/4504127908456925/6716386,0,0,2021-02-09T22:42:34.0+07:00,,"{'id': '4504127908456925', 'type': 'branch'}","{'id': '4166710', 'reviews_count': 1, 'first_name': 'Маргарита', 'last_name': None, 'name': 'Маргарита', 'provider': 'flamp', 'photo_preview_urls': {'1920x': 'https://cdn1.flamp.ru/default-avatar-m_1920.png', '320x': 'https://cdn1.flamp.ru/default-avatar-m_320.png', '640x': 'https://cdn1.flamp.ru/default-avatar-m_640.png', '64x64': 'https://cdn1.flamp.ru/default-avatar-m_64_64.png', 'url': 'https://cdn1.flamp.ru/default-avatar-m.png'}, 'url': 'http://flamp.ru/user4166710', 'additional_data': {'email': None}}",,[],"{'status_history': [], 'has_unresolved_complaints': False, 'pin_status': 'none', 'ip': '', 'user_agent': '', 'external_id': '6716386', 'filtered_facts': None, 'is_unrated_permanently': None, 'is_liked': None}",False,True,False
