id,region_id,text,rating,provider,source,is_hidden,hiding_type,hiding_reason,url,likes_count,comments_count,date_created,date_edited,object,user,official_answer,photos,additional_data,on_moderation,is_rated,is_verified
23415108,19,"Перешел на Багиру с Центуриона , дешевле в 2 раза обслуживание частного дома, гбр приехала быстро , по моей вине сработала сигналка, не успел вовремя отключить , приехали качки с оружием за 7 минут, не было штрафа за ложный вызов , клиент ориентированы , это приятно",5,2gis,,False,,,,0,0,2021-09-01T17:03:58.537599+07:00,,"{'id': '2674540559781594', 'type': 'branch'}","{'id': '27034229', 'reviews_count': 3, 'first_name': 'Тим Мум', 'last_name': None, 'name': 'Тим Мум', 'provider': '2gis', 'photo_preview_urls': {'1920x': '', '320x': '', '640x': '', '64x64': '', 'url': ''}, 'url': '', 'additional_data': {'email': None}}",,[],"{'status_history': [], 'has_unresolved_complaints': False, 'pin_status': 'none', 'ip': '', 'user_agent': '', 'external_id': None, 'filtered_facts': None, 'is_unrated_permanently': None, 'is_liked': None}",False,True,False
22045443,19,Самые низкие ставки у охранников в городе. Вызвали на подработку за наличные. Работу не оплатили.,1,2gis,,False,,,,0,0,2021-07-01T20:06:54.687743+07:00,,"{'id': '2674540559781594', 'type': 'branch'}","{'id': '27548510', 'reviews_count': 1, 'first_name': 'ННт 52', 'last_name': None, 'name': 'ННт 52', 'provider': '2gis', 'photo_preview_urls': {'1920x': '', '320x': '', '640x': '', '64x64': '', 'url': ''}, 'url': '', 'additional_data': {'email': None}}",,[],"{'status_history': [], 'has_unresolved_complaints': False, 'pin_status': 'none', 'ip': '', 'user_agent': '', 'external_id': None, 'filtered_facts': None, 'is_unrated_permanently': None, 'is_liked': None}",False,True,False
23755433,19,"Не знаю что за организация, но наглость невероятная со стороны хабалки на Ладе калине. Эта блохастая заблокировала машину и 15 минут отключала сигнализацию не выпуская мою машину, а когда вышла нагло начала нести чушь, что организация платит за парковку возле жилого дома и показала рукой на самодельный знак 15- летней давности. На сайте городоюа Нижнего Новгорода где можно посмотреть частные парковки и официаные шлагбаумы, данная стоянка отсутствует в собственности данной компании, мужики работники данной организации которые курили у своих автомобилей в нашу дискуссию даже не вступили, что говорит: во первых о их принадлежности (пид...сы сыкли.......вые), во вторых к правде, что стоянка принадлежит всё-таки жильцам дома. Если такие сотрудники, значит и качество организации соответствующее, если кто то из организации готов мне что то противопоставить, готов встретиться в дискуссию в переписке вступать не готов, но скорее эти сыкломэны так и останутся сидеть в заперти в офисе и терпелить. К таким людям обращаться не советую, за свою работу, скорее всего не качественную ответить не смогут.",1,2gis,,False,,,,0,0,2021-09-17T02:14:22.693695+07:00,,"{'id': '2674540559749693', 'type': 'branch'}","{'id': '30227188', 'reviews_count': 2, 'first_name': 'Алексей Гаврилов', 'last_name': None, 'name': 'Алексей Гаврилов', 'provider': '2gis', 'photo_preview_urls': {'1920x': '', '320x': '', '640x': '', '64x64': '', 'url': ''}, 'url': '', 'additional_data': {'email': None}}",,[],"{'status_history': [], 'has_unresolved_complaints': False, 'pin_status': 'none', 'ip': '', 'user_agent': '', 'external_id': None, 'filtered_facts': None, 'is_unrated_permanently': None, 'is_liked': None}",False,True,False
14264067,19,"Быстро среагировали на заявку о подключении, не прошло и дня, как подключили и взяли под охрану. Поставили новое оборудование. Адекватные цены.
Рекомендую.",5,2gis,,False,,,,0,0,2020-03-04T14:35:19.280383+07:00,,"{'id': '2674540559815356', 'type': 'branch'}","{'id': '20218042', 'reviews_count': 9, 'first_name': 'Sweet Bit', 'last_name': None, 'name': 'Sweet Bit', 'provider': '2gis', 'photo_preview_urls': {'1920x': 'https://i4.photo.2gis.com/images/profile/844424968422120_d4f1_1920x.jpg', '320x': 'https://i4.photo.2gis.com/images/profile/844424968422120_d4f1_320x.jpg', '640x': 'https://i4.photo.2gis.com/images/profile/844424968422120_d4f1_640x.jpg', '64x64': 'https://i4.photo.2gis.com/images/profile/844424968422120_d4f1_64x64.jpg', 'url': 'https://i4.photo.2gis.com/images/profile/844424968422120_d4f1.jpg'}, 'url': '', 'additional_data': {'email': None}}",,[],"{'status_history': [], 'has_unresolved_complaints': False, 'pin_status': 'none', 'ip': '', 'user_agent': '', 'external_id': None, 'filtered_facts': None, 'is_unrated_permanently': None, 'is_liked': None}",False,True,False
1198754,19,"Охрана на АЗС Газпромнефть Беркут, либо работать не хотят либо они сами по себе такие. Если пошли работать так пусть работают тогда а не фигней страдают на рабочем месте. Всех кого встречал очень самодовольные типы. Не однократно наблюдал за их работой когда приезжает инкассация. Их либо вообще нет на месте, либо стоят вообще в стороне. В ночное время постоянно спят, либо в машине в своей-(впрочем в машине они и едят) либо прям на стуле возле операторов забившись в угол-(забившись в угол как котенок.",3,flamp,,False,,,https://flamp.ru/r/2674540559751663/1855443,0,0,2016-02-12T16:27:34.232771+06:00,,"{'id': '2674540559751663', 'type': 'branch'}","{'id': '1018058', 'reviews_count': 4, 'first_name': 'Игорь', 'last_name': None, 'name': 'Игорь', 'provider': 'flamp', 'photo_preview_urls': {'1920x': 'https://cdn.flamp.ru/22ecb1a6a55afee94d313fad8597fd35_1920.jpg', '320x': 'https://cdn.flamp.ru/22ecb1a6a55afee94d313fad8597fd35_320.jpg', '640x': 'https://cdn.flamp.ru/22ecb1a6a55afee94d313fad8597fd35_640.jpg', '64x64': 'https://cdn.flamp.ru/22ecb1a6a55afee94d313fad8597fd35_64_64.jpg', 'url': 'https://cdn.flamp.ru/22ecb1a6a55afee94d313fad8597fd35.jpg'}, 'url': 'http://flamp.ru/user1018058', 'additional_data': {'email': None}}",,[],"{'status_history': [], 'has_unresolved_complaints': False, 'pin_status': 'none', 'ip': '', 'user_agent': '', 'external_id': '1855443', 'filtered_facts': None, 'is_unrated_permanently': None, 'is_liked': None}",False,True,False
20962557,19,"Постоянная задержка ЗП.  Практически на 1,5 месяца. Это показывает отшошение к охранникам , как к людям низшего сорта!",1,flamp,,False,,,https://flamp.ru/r/2674540559835720/6918969,0,0,2021-05-11T18:29:14.0+07:00,,"{'id': '2674540559835720', 'type': 'branch'}","{'id': '2379102', 'reviews_count': 33, 'first_name': 'Тайный Флампер', 'last_name': None, 'name': 'Тайный Флампер', 'provider': 'flamp', 'photo_preview_urls': {'1920x': 'https://cdn1.flamp.ru/default-avatar-m_1920.png', '320x': 'https://cdn1.flamp.ru/default-avatar-m_320.png', '640x': 'https://cdn1.flamp.ru/default-avatar-m_640.png', '64x64': 'https://cdn1.flamp.ru/default-avatar-m_64_64.png', 'url': 'https://cdn1.flamp.ru/default-avatar-m.png'}, 'url': 'http://flamp.ru/user2379102', 'additional_data': {'email': None}}",,[],"{'status_history': [], 'has_unresolved_complaints': False, 'pin_status': 'none', 'ip': '', 'user_agent': '', 'external_id': '6918969', 'filtered_facts': None, 'is_unrated_permanently': None, 'is_liked': None}",False,True,False
24641812,19,"Сотрудник ГБР приехал через 20 минут, по договору 10, сидел в машине и ничего не делал, муж пошёл к нему спросил «почему не реагируете», на что он ответил «так не понимаю куда надо было идти», написали жалобу, но реакции никакой, в офисе никакой информации не предоставляют, будем писать на расторжение, такая охрана не нужна, деньги на ветер просто, обслуживание клиентов на самом низком уровне.",1,flamp,,False,,,https://flamp.ru/r/2674540563439108/7254692,0,0,2021-10-26T02:21:31.0+07:00,,"{'id': '2674540563439108', 'type': 'branch'}","{'id': '4452504', 'reviews_count': 1, 'first_name': 'fowag72977', 'last_name': None, 'name': 'fowag72977', 'provider': 'flamp', 'photo_preview_urls': {'1920x': 'https://cdn1.flamp.ru/default-avatar-m_1920.png', '320x': 'https://cdn1.flamp.ru/default-avatar-m_320.png', '640x': 'https://cdn1.flamp.ru/default-avatar-m_640.png', '64x64': 'https://cdn1.flamp.ru/default-avatar-m_64_64.png', 'url': 'https://cdn1.flamp.ru/default-avatar-m.png'}, 'url': 'http://flamp.ru/user4452504', 'additional_data': {'email': None}}",,[],"{'status_history': [], 'has_unresolved_complaints': False, 'pin_status': 'none', 'ip': '', 'user_agent': '', 'external_id': '7254692', 'filtered_facts': None, 'is_unrated_permanently': None, 'is_liked': None}",False,True,False
24616131,19,"Уже несколько дней не могу дозвонится до компании. Не работает оборудование, компания не позвонила, у них же ведь должно отображаться, что оборудование не работает. Пытаюсь как-то дозвониться, чтобы направили инженера на починку, но соответственно никто трубку не берут, и инженера видимо не будет, раз даже не звонят о том, что сигнал не проходит. Наверное деньги плачу, для того чтобы у меня что-то стояло.",1,flamp,,False,,,https://flamp.ru/r/2674540563439108/7252251,0,0,2021-10-24T23:44:55.0+07:00,,"{'id': '2674540563439108', 'type': 'branch'}","{'id': '4451207', 'reviews_count': 1, 'first_name': 'bakor75842', 'last_name': None, 'name': 'bakor75842', 'provider': 'flamp', 'photo_preview_urls': {'1920x': 'https://cdn1.flamp.ru/default-avatar-m_1920.png', '320x': 'https://cdn1.flamp.ru/default-avatar-m_320.png', '640x': 'https://cdn1.flamp.ru/default-avatar-m_640.png', '64x64': 'https://cdn1.flamp.ru/default-avatar-m_64_64.png', 'url': 'https://cdn1.flamp.ru/default-avatar-m.png'}, 'url': 'http://flamp.ru/user4451207', 'additional_data': {'email': None}}",,[],"{'status_history': [], 'has_unresolved_complaints': False, 'pin_status': 'none', 'ip': '', 'user_agent': '', 'external_id': '7252251', 'filtered_facts': None, 'is_unrated_permanently': None, 'is_liked': None}",False,True,False
6107604,19,"Установили на свой магазин сигнализацию, потому что был инцидент со взломом. Выбрали именно это охранное предприятие. Что сказать...работают отвратительно. Сигнализация работает когда не надо, и не работает когда необходимо. А охрана приезжает очень медленно. Не рекомендую к ним обращаться, если не хотите остаться без своего имущества.",1,flamp,,False,,,https://flamp.ru/r/2674540559749772/4052489,0,1,2018-03-13T02:18:57.0+07:00,,"{'id': '2674540559749772', 'type': 'branch'}","{'id': '2251491', 'reviews_count': 1, 'first_name': 'Светлана Арсеньева', 'last_name': None, 'name': 'Светлана Арсеньева', 'provider': 'flamp', 'photo_preview_urls': {'1920x': 'https://cdn1.flamp.ru/00a08f8270e24de08b59007012e1a59b_1920.jpg', '320x': 'https://cdn1.flamp.ru/00a08f8270e24de08b59007012e1a59b_320.jpg', '640x': 'https://cdn1.flamp.ru/00a08f8270e24de08b59007012e1a59b_640.jpg', '64x64': 'https://cdn1.flamp.ru/00a08f8270e24de08b59007012e1a59b_64_64.jpg', 'url': 'https://cdn1.flamp.ru/00a08f8270e24de08b59007012e1a59b.jpg'}, 'url': 'http://flamp.ru/user2251491', 'additional_data': {'email': None}}","{'id': '855901', 'org_name': 'Центурион-НН, частная охранная организация', 'text': 'Добрый день! Подскажите адрес Вашего магазина для детального решения проблемы.', 'date_created': '2018-03-13T12:24:59.0+07:00', 'logo_preview_urls': {'1920x': 'https://cdn1.flamp.ru/default-logo_1920.png', '320x': 'https://cdn1.flamp.ru/default-logo_320.png', '640x': 'https://cdn1.flamp.ru/default-logo_640.png', '64x64': 'https://cdn1.flamp.ru/default-logo_64_64.png', 'url': 'https://cdn1.flamp.ru/default-logo.png'}}",[],"{'status_history': [], 'has_unresolved_complaints': False, 'pin_status': 'none', 'ip': '', 'user_agent': '', 'external_id': '4052489', 'filtered_facts': None, 'is_unrated_permanently': None, 'is_liked': None}",False,True,False
1532508,19,"Устанавливал сигнализацию в дом. Все сделали хорошо, по цене устроило. Немного дороже, чем у других, зато слепых зон не оставили.  Через год у них же монтировал видео. Все без проблем работает. Советую не экономить на безопасности своего имущества и обращаться!",5,flamp,,False,,,https://flamp.ru/r/2674540559749772/2327011,0,0,2016-08-01T18:07:02.996638+07:00,,"{'id': '2674540559749772', 'type': 'branch'}","{'id': '1266584', 'reviews_count': 1, 'first_name': 'misterigor', 'last_name': None, 'name': 'misterigor', 'provider': 'flamp', 'photo_preview_urls': {'1920x': 'https://cdn.flamp.ru/default-avatar-m_1920.png', '320x': 'https://cdn.flamp.ru/default-avatar-m_320.png', '640x': 'https://cdn.flamp.ru/default-avatar-m_640.png', '64x64': 'https://cdn.flamp.ru/default-avatar-m_64_64.png', 'url': 'https://cdn.flamp.ru/default-avatar-m.png'}, 'url': 'http://flamp.ru/user1266584', 'additional_data': {'email': None}}",,[],"{'status_history': [], 'has_unresolved_complaints': False, 'pin_status': 'none', 'ip': '', 'user_agent': '', 'external_id': '2327011', 'filtered_facts': None, 'is_unrated_permanently': None, 'is_liked': None}",False,True,False
1014374,19,"Поставил дом под охрану. Монтаж охранной сигнализации произвели быстро и качественно. На все мои вопросы и проблемы оперативно реагируют. 
Была ложная сработка, но несмотря ни на что очень быстро приехала мобильная группа и проверила все ли впорядке. 
Также порадовали приемлемые цены. Рекомендую.",5,flamp,,False,,,https://flamp.ru/r/2674540559749772/1596714,0,0,2015-11-03T14:05:21.172859+06:00,,"{'id': '2674540559749772', 'type': 'branch'}","{'id': '891044', 'reviews_count': 1, 'first_name': 'vorbor35', 'last_name': None, 'name': 'vorbor35', 'provider': 'flamp', 'photo_preview_urls': {'1920x': 'https://cdn.flamp.ru/default-avatar-m_1920.png', '320x': 'https://cdn.flamp.ru/default-avatar-m_320.png', '640x': 'https://cdn.flamp.ru/default-avatar-m_640.png', '64x64': 'https://cdn.flamp.ru/default-avatar-m_64_64.png', 'url': 'https://cdn.flamp.ru/default-avatar-m.png'}, 'url': 'http://flamp.ru/user891044', 'additional_data': {'email': None}}",,[],"{'status_history': [], 'has_unresolved_complaints': False, 'pin_status': 'none', 'ip': '', 'user_agent': '', 'external_id': '1596714', 'filtered_facts': None, 'is_unrated_permanently': None, 'is_liked': None}",False,True,False
12725876,19,Добро пожаловать. Если Вам и Вашей семье ненужны деньги. Просто работайте и все,1,2gis,,False,,,,0,1,2019-11-22T21:02:12.348849+07:00,,"{'id': '2674540559751221', 'type': 'branch'}","{'id': '20108746', 'reviews_count': 3, 'first_name': 'Александр Левин', 'last_name': None, 'name': 'Александр Левин', 'provider': '2gis', 'photo_preview_urls': {'1920x': '', '320x': '', '640x': '', '64x64': '', 'url': ''}, 'url': '', 'additional_data': {'email': None}}","{'id': '2761235', 'org_name': 'Ассоциация Русь НН, частная охранная организация', 'text': 'Добрый день, могу то же самое сказать о качестве Вашей работы. У нас есть добросовестные сотрудники с большим стажем работы в нашей организации.', 'date_created': '2019-11-26T17:30:10.702148+07:00', 'logo_preview_urls': {}}",[],"{'status_history': [], 'has_unresolved_complaints': False, 'pin_status': 'none', 'ip': '', 'user_agent': '', 'external_id': None, 'filtered_facts': None, 'is_unrated_permanently': None, 'is_liked': None}",False,True,False
6606026,19,"Бардачная контора. Организации нет никакой. Подписался на охрану ЧМ по футболу, и что? Помещения для охранников нет, в туалет, на обед никто не поменяет, смена постов-это с одного поста на другой! Народ бежит! Понятно, деньги, которые должны выплачиваться наличными после смены, распределятся по чьим-то карманам. Не рекомендую никому!",1,2gis,,False,,,,1,0,2018-05-31T19:54:32.799269+07:00,,"{'id': '2674540559904487', 'type': 'branch'}","{'id': '13731053', 'reviews_count': 1, 'first_name': 'Николай Хонин', 'last_name': None, 'name': 'Николай Хонин', 'provider': '2gis', 'photo_preview_urls': {'1920x': '', '320x': '', '640x': '', '64x64': '', 'url': ''}, 'url': '', 'additional_data': {'email': None}}",,[],"{'status_history': [], 'has_unresolved_complaints': False, 'pin_status': 'none', 'ip': '', 'user_agent': '', 'external_id': None, 'filtered_facts': None, 'is_unrated_permanently': None, 'is_liked': None}",False,True,False
15151998,19,"Номер данной конторы был указан в договоре на установку камер видеонаблюдения с ИП Суконников А.С. Это подрядчик, которого предоставляет город для установки камер и подключения к городской видеоаналитике малому бизнесу. Все было хорошо, как обычно ровно до момента оплаты счета. Поскольку дальше перестали отвечать на почту (а общение велось там). У нас 4 объекта для подключения и мы просили составить график или назвать даты планируемых подключений, на что получали игнор. Потом в очередной день игнора звонит монтажник и говорит ""приедем через час устанавливать камеры"", на что я ответил, что не могу, поскольку день расписан, а поскольку наш бизнес - это парикмахерские, то очевидно, что мы не работаем и никто на месте встретить их не сможет тем более на таком коротком уведомлении (еще раз повторюсь, не были даже даты монтажа назначены). Так случилось и со второй точкой. Две точки смонтированы были только через ругань и требование уведомить заранее, но этого не случалось, приходилось подстраиваться под этих ""монтажников"". Видимо так они себя вели, поскольку понимали, что это нам нужно в первую очередь и что счет оплачен уже, а значит можно расслабиться. Неоднократно пытаясь объяснить ситуацию, давали понять, что к нам едут по ""остаточному принципу"", то есть когда какой-то клиент отменяется. После очередного письма с обозначением что это последняя попытка пообщаться нормально и решить вопрос, ответили на все 5 неотвеченых писем и ""о боги"", позвонили заранее и сказали, что ""завтра в 11 приедем устанавливать вам камеры в точку в Дзержинске"". Подумал, что наконец взялись за голову. Оказалось нет. Поскольку по итогу прождал я их 4 часа, на мои звонки с требованием объяснить где монтажники, внятного ответа не было, лилась вода, в которой всю вину скидывали на этих рабочих и искренне недоумевали почему же я так негодую (хотя скорее делали вид, что искренне были удивлены). Пишу отзыв во время как раз ожидания этой бригады в Дзержинске. НЕ РЕКОМЕНДУЮ НИКОМУ!",1,2gis,,False,,,,0,0,2020-05-29T18:00:52.999897+07:00,,"{'id': '2674540563082637', 'type': 'branch'}","{'id': '23538369', 'reviews_count': 1, 'first_name': 'Юрий Глазков', 'last_name': None, 'name': 'Юрий Глазков', 'provider': '2gis', 'photo_preview_urls': {'1920x': 'https://i1.photo.2gis.com/images/profile/30258560048282386_223f_1920x.jpg', '320x': 'https://i1.photo.2gis.com/images/profile/30258560048282386_223f_320x.jpg', '640x': 'https://i1.photo.2gis.com/images/profile/30258560048282386_223f_640x.jpg', '64x64': 'https://i1.photo.2gis.com/images/profile/30258560048282386_223f_64x64.jpg', 'url': 'https://i1.photo.2gis.com/images/profile/30258560048282386_223f.jpg'}, 'url': '', 'additional_data': {'email': None}}",,[],"{'status_history': [], 'has_unresolved_complaints': False, 'pin_status': 'none', 'ip': '', 'user_agent': '', 'external_id': None, 'filtered_facts': None, 'is_unrated_permanently': None, 'is_liked': None}",False,True,False
