id,region_id,text,rating,provider,source,is_hidden,hiding_type,hiding_reason,url,likes_count,comments_count,date_created,date_edited,object,user,official_answer,photos,additional_data,on_moderation,is_rated,is_verified
10327614,19,"Очень понравилось обслуживание от компании Дельта. Приехали, быстро и качественно установили оборудование, в течении суток наш офис уже встал под охрану. Дополнительной платы не вносили. Через некоторое время проверили на реагирование, всё устраивает. Компания и вправду классная. Спасибо!",5,flamp,,False,,,https://flamp.ru/r/2674540563987556/5348492,0,0,2019-06-09T23:31:00.0+07:00,,"{'id': '2674540563987556', 'type': 'branch'}","{'id': '3016180', 'reviews_count': 1, 'first_name': 'Альбина Маслова', 'last_name': None, 'name': 'Альбина Маслова', 'provider': 'flamp', 'photo_preview_urls': {'1920x': 'https://cdn1.flamp.ru/default-avatar-m_1920.png', '320x': 'https://cdn1.flamp.ru/default-avatar-m_320.png', '640x': 'https://cdn1.flamp.ru/default-avatar-m_640.png', '64x64': 'https://cdn1.flamp.ru/default-avatar-m_64_64.png', 'url': 'https://cdn1.flamp.ru/default-avatar-m.png'}, 'url': 'http://flamp.ru/user3016180', 'additional_data': {'email': None}}",,[],"{'status_history': [], 'has_unresolved_complaints': False, 'pin_status': 'none', 'ip': '', 'user_agent': '', 'external_id': '5348492', 'filtered_facts': None, 'is_unrated_permanently': None, 'is_liked': None}",False,True,False
10159918,19,"Компания Дельта помогла пройти проверку МЧС на пожарную безопасность. Всю систему поставили в соответствии с нормами, подготовили проект. Так же мы заключили договор на техническое обслуживание данной сигнализации, по цене получилось выгодно. Благодарю сотрудников за монтаж без повреждения свежего ремонта.  Пока довольна сотрудничеством.",5,flamp,,False,,,https://flamp.ru/r/2674540563987556/5310346,0,0,2019-05-26T02:12:17.0+07:00,,"{'id': '2674540563987556', 'type': 'branch'}","{'id': '2996776', 'reviews_count': 1, 'first_name': 'Марина Журова', 'last_name': None, 'name': 'Марина Журова', 'provider': 'flamp', 'photo_preview_urls': {'1920x': 'https://cdn1.flamp.ru/default-avatar-m_1920.png', '320x': 'https://cdn1.flamp.ru/default-avatar-m_320.png', '640x': 'https://cdn1.flamp.ru/default-avatar-m_640.png', '64x64': 'https://cdn1.flamp.ru/default-avatar-m_64_64.png', 'url': 'https://cdn1.flamp.ru/default-avatar-m.png'}, 'url': 'http://flamp.ru/user2996776', 'additional_data': {'email': None}}",,[],"{'status_history': [], 'has_unresolved_complaints': False, 'pin_status': 'none', 'ip': '', 'user_agent': '', 'external_id': '5310346', 'filtered_facts': None, 'is_unrated_permanently': None, 'is_liked': None}",False,True,False
10080875,19,"Поставила гараж под охрану в Дельте, все мне у них понравилось. Сейчас акция хорошая, система почти даром выходит. Докупила сирену, чтобы могли спугнуть грабителей. У нас в кооперативе уже были кражи, поэтому решила обезопасить имущество.",4,2gis,,False,,,,0,0,2019-05-19T02:12:07.077417+07:00,,"{'id': '2674540563987556', 'type': 'branch'}","{'id': '18852298', 'reviews_count': 1, 'first_name': 'Тамара', 'last_name': None, 'name': 'Тамара', 'provider': '2gis', 'photo_preview_urls': {'1920x': '', '320x': '', '640x': '', '64x64': '', 'url': ''}, 'url': '', 'additional_data': {'email': None}}",,[],"{'status_history': [], 'has_unresolved_complaints': False, 'pin_status': 'none', 'ip': '', 'user_agent': '', 'external_id': None, 'filtered_facts': None, 'is_unrated_permanently': None, 'is_liked': None}",False,True,False
10054311,19,"Купил квартиру, а там уже было оборудование Дельты. Старый собственник их похвалил: ездят быстро, работают качественно и надежно. Я до этого с ними не сталкивался, работал с другими чопами. Ну решил попробовать, тем более саму сигнализацию уже не нужно покупать. Мне понравилась в Дельте приложение функциональное, да и сотрудники компетентные. Посмотрю как работают, но пока все хорошо, дешево и все доступно.",4,flamp,,False,,,https://flamp.ru/r/2674540563987556/5286134,0,0,2019-05-16T19:37:10.0+07:00,,"{'id': '2674540563987556', 'type': 'branch'}","{'id': '2984231', 'reviews_count': 1, 'first_name': 'Дмитрий Шилов', 'last_name': None, 'name': 'Дмитрий Шилов', 'provider': 'flamp', 'photo_preview_urls': {'1920x': 'https://cdn1.flamp.ru/default-avatar-m_1920.png', '320x': 'https://cdn1.flamp.ru/default-avatar-m_320.png', '640x': 'https://cdn1.flamp.ru/default-avatar-m_640.png', '64x64': 'https://cdn1.flamp.ru/default-avatar-m_64_64.png', 'url': 'https://cdn1.flamp.ru/default-avatar-m.png'}, 'url': 'http://flamp.ru/user2984231', 'additional_data': {'email': None}}",,[],"{'status_history': [], 'has_unresolved_complaints': False, 'pin_status': 'none', 'ip': '', 'user_agent': '', 'external_id': '5286134', 'filtered_facts': None, 'is_unrated_permanently': None, 'is_liked': None}",False,True,False
9888874,19,"Пользуюсь услугами Дельты больше года, у меня их тревожная кнопка. Выбирал современный и дешевый вариант, как оказалось сейчас существует мобильный вариант. Прямо из приложения на смартфоне могу вызвать охрану. За квартиру в месяц всего 500 рублей, зато спокойно по ночам. Работой сотрудников доволен, служба поддержки помогает решать любые вопросы. И главное в офис ездить не нужно, все делают удаленно.",4,flamp,,False,,,https://flamp.ru/r/2674540563987556/5248818,0,0,2019-05-01T00:40:50.0+07:00,,"{'id': '2674540563987556', 'type': 'branch'}","{'id': '2966089', 'reviews_count': 1, 'first_name': 'Захар Гуляев', 'last_name': None, 'name': 'Захар Гуляев', 'provider': 'flamp', 'photo_preview_urls': {'1920x': 'https://cdn1.flamp.ru/default-avatar-m_1920.png', '320x': 'https://cdn1.flamp.ru/default-avatar-m_320.png', '640x': 'https://cdn1.flamp.ru/default-avatar-m_640.png', '64x64': 'https://cdn1.flamp.ru/default-avatar-m_64_64.png', 'url': 'https://cdn1.flamp.ru/default-avatar-m.png'}, 'url': 'http://flamp.ru/user2966089', 'additional_data': {'email': None}}",,[],"{'status_history': [], 'has_unresolved_complaints': False, 'pin_status': 'none', 'ip': '', 'user_agent': '', 'external_id': '5248818', 'filtered_facts': None, 'is_unrated_permanently': None, 'is_liked': None}",False,True,False
9771108,19,"Благодарен Дельте за надежную охрану моего дачного дома, уже много лет с ними работаю и полностью доволен. На летний период можно делать приостановку, пока живу на даче. Качество обслуживания полностью оправдывает стоимость услуг, все сотрудники вежливые и реально пытаются помочь, а не просто от тебя отделаться.",5,2gis,,False,,,,0,0,2019-04-20T20:09:22.216274+07:00,,"{'id': '2674540563987556', 'type': 'branch'}","{'id': '18520871', 'reviews_count': 2, 'first_name': 'Степан Романов', 'last_name': None, 'name': 'Степан Романов', 'provider': '2gis', 'photo_preview_urls': {'1920x': 'https://i1.photo.2gis.com/images/profile/844424968423638_4bf6_1920x.jpg', '320x': 'https://i1.photo.2gis.com/images/profile/844424968423638_4bf6_320x.jpg', '640x': 'https://i1.photo.2gis.com/images/profile/844424968423638_4bf6_640x.jpg', '64x64': 'https://i1.photo.2gis.com/images/profile/844424968423638_4bf6_64x64.jpg', 'url': 'https://i1.photo.2gis.com/images/profile/844424968423638_4bf6.jpg'}, 'url': '', 'additional_data': {'email': None}}",,[],"{'status_history': [], 'has_unresolved_complaints': False, 'pin_status': 'none', 'ip': '', 'user_agent': '', 'external_id': None, 'filtered_facts': None, 'is_unrated_permanently': None, 'is_liked': None}",False,True,False
9159978,19,"Поставил на охрану квартиру, все очень нравится, установили мобильное приложение, очень удобно снимать и ставить сигнализацию через личный кабинет, нигде такого не видел",5,2gis,,False,,,,0,0,2019-02-27T23:08:10.421141+07:00,,"{'id': '2674540563987556', 'type': 'branch'}","{'id': '17855466', 'reviews_count': 4, 'first_name': 'Артем Абдризяков', 'last_name': None, 'name': 'Артем Абдризяков', 'provider': '2gis', 'photo_preview_urls': {'1920x': 'https://i0.photo.2gis.com/images/profile/844424968422262_6951_1920x.jpg', '320x': 'https://i0.photo.2gis.com/images/profile/844424968422262_6951_320x.jpg', '640x': 'https://i0.photo.2gis.com/images/profile/844424968422262_6951_640x.jpg', '64x64': 'https://i0.photo.2gis.com/images/profile/844424968422262_6951_64x64.jpg', 'url': 'https://i0.photo.2gis.com/images/profile/844424968422262_6951.jpg'}, 'url': '', 'additional_data': {'email': None}}",,[],"{'status_history': [], 'has_unresolved_complaints': False, 'pin_status': 'none', 'ip': '', 'user_agent': '', 'external_id': None, 'filtered_facts': None, 'is_unrated_permanently': None, 'is_liked': None}",False,True,False
9085244,19,"Обратился в Дельту для охраны дачного домика, который находится в 8 км от города. За все время сотрудничества нареканий нет. Мне нравится общение менеджера (без проблем можно позвонить на горячку и все решить), доступная цена и быстрый выезд группы при срабатывании сигнализации. Например, прошлой зимой была сработка, когда шел снегопад, то дежурная машина все равно приехала на объект, проверили замки и прислали мне отчет, что все нормально!",4,flamp,,False,,,https://flamp.ru/r/2674540563987556/5051020,0,0,2019-02-21T02:37:01.0+07:00,2019-02-21T02:39:04.0+07:00,"{'id': '2674540563987556', 'type': 'branch'}","{'id': '2858876', 'reviews_count': 1, 'first_name': 'Семен', 'last_name': None, 'name': 'Семен', 'provider': 'flamp', 'photo_preview_urls': {'1920x': 'https://cdn1.flamp.ru/default-avatar-m_1920.png', '320x': 'https://cdn1.flamp.ru/default-avatar-m_320.png', '640x': 'https://cdn1.flamp.ru/default-avatar-m_640.png', '64x64': 'https://cdn1.flamp.ru/default-avatar-m_64_64.png', 'url': 'https://cdn1.flamp.ru/default-avatar-m.png'}, 'url': 'http://flamp.ru/user2858876', 'additional_data': {'email': None}}",,[],"{'status_history': [], 'has_unresolved_complaints': False, 'pin_status': 'none', 'ip': '', 'user_agent': '', 'external_id': '5051020', 'filtered_facts': None, 'is_unrated_permanently': None, 'is_liked': None}",False,True,False
9041228,19,"Хотелось бы от себя и от лица сотрудников бара выразить признательность и искреннюю благодарность ребятам из Дельты за быстрое прибытие и качественное выполнение договорных обязательств по охране нашего объекта
Охранники гбр проявили бдительность и высокий профессионализм. Конфликт решили спокойно и без применения силы.",4,flamp,,False,,,https://flamp.ru/r/2674540563987556/5039007,0,0,2019-02-17T01:58:11.0+07:00,,"{'id': '2674540563987556', 'type': 'branch'}","{'id': '2852676', 'reviews_count': 1, 'first_name': 'Виктория', 'last_name': None, 'name': 'Виктория', 'provider': 'flamp', 'photo_preview_urls': {'1920x': 'https://cdn1.flamp.ru/default-avatar-m_1920.png', '320x': 'https://cdn1.flamp.ru/default-avatar-m_320.png', '640x': 'https://cdn1.flamp.ru/default-avatar-m_640.png', '64x64': 'https://cdn1.flamp.ru/default-avatar-m_64_64.png', 'url': 'https://cdn1.flamp.ru/default-avatar-m.png'}, 'url': 'http://flamp.ru/user2852676', 'additional_data': {'email': None}}",,[],"{'status_history': [], 'has_unresolved_complaints': False, 'pin_status': 'none', 'ip': '', 'user_agent': '', 'external_id': '5039007', 'filtered_facts': None, 'is_unrated_permanently': None, 'is_liked': None}",False,True,False
8994646,19,"Когда открыли небольшой магазинчик, старались своими силами охраняться, затем перешли на режим 24 часа и тут уж точно пришлось думать о кнопке, а то в ночное время столько неадекватных людей. Стремясь обеспечить защиту от грабежей и нападений, мы установили охранную систему Дельта, самый бюджетный вариант. установили кнопку в мобильный телефон. Платим только за ежемесячное обслуживание.Цена не велика, зато пользуемся регулярно.",4,flamp,,False,,,https://flamp.ru/r/2674540563987556/5027038,0,0,2019-02-13T02:48:52.0+07:00,,"{'id': '2674540563987556', 'type': 'branch'}","{'id': '2846347', 'reviews_count': 1, 'first_name': 'Марсель', 'last_name': None, 'name': 'Марсель', 'provider': 'flamp', 'photo_preview_urls': {'1920x': 'https://cdn1.flamp.ru/default-avatar-m_1920.png', '320x': 'https://cdn1.flamp.ru/default-avatar-m_320.png', '640x': 'https://cdn1.flamp.ru/default-avatar-m_640.png', '64x64': 'https://cdn1.flamp.ru/default-avatar-m_64_64.png', 'url': 'https://cdn1.flamp.ru/default-avatar-m.png'}, 'url': 'http://flamp.ru/user2846347', 'additional_data': {'email': None}}",,[],"{'status_history': [], 'has_unresolved_complaints': False, 'pin_status': 'none', 'ip': '', 'user_agent': '', 'external_id': '5027038', 'filtered_facts': None, 'is_unrated_permanently': None, 'is_liked': None}",False,True,False
8970341,19,"Хотела бы выразить благодарность руководству и сотрудникам компании «Дельта» за хорошую работу, помощь в решении нестандартных ситуаций, особый подход к реализации нашего индивидуального проекта на пожарную охрану.  Помещение немного нестандартное, спасибо монтажникам, что учли все наши пожелания.",4,flamp,,False,,,https://flamp.ru/r/2674540563987556/5020659,0,0,2019-02-11T02:06:53.0+07:00,,"{'id': '2674540563987556', 'type': 'branch'}","{'id': '2842913', 'reviews_count': 1, 'first_name': 'Илья', 'last_name': None, 'name': 'Илья', 'provider': 'flamp', 'photo_preview_urls': {'1920x': 'https://cdn1.flamp.ru/default-avatar-m_1920.png', '320x': 'https://cdn1.flamp.ru/default-avatar-m_320.png', '640x': 'https://cdn1.flamp.ru/default-avatar-m_640.png', '64x64': 'https://cdn1.flamp.ru/default-avatar-m_64_64.png', 'url': 'https://cdn1.flamp.ru/default-avatar-m.png'}, 'url': 'http://flamp.ru/user2842913', 'additional_data': {'email': None}}",,[],"{'status_history': [], 'has_unresolved_complaints': False, 'pin_status': 'none', 'ip': '', 'user_agent': '', 'external_id': '5020659', 'filtered_facts': None, 'is_unrated_permanently': None, 'is_liked': None}",False,True,False
8306617,19,"Устанавливала систему видеонаблбления в компании Дельта, понравилось то, что инженер приехал быстро, составили с ним список того, что мне нужно, через пару дней прислали смету, она мне показалась очень даже приемлемой, снова приехал инженер, все установил, все камеры работают исправно, сейчас новую точку открываем, хотим установить охраную здесь же.",5,2gis,,False,,,,0,0,2018-12-04T18:55:59.995112+07:00,,"{'id': '2674540563987556', 'type': 'branch'}","{'id': '16372666', 'reviews_count': 1, 'first_name': 'Настя Варакина', 'last_name': None, 'name': 'Настя Варакина', 'provider': '2gis', 'photo_preview_urls': {'1920x': 'https://i6.photo.2gis.com/images/profile/844424966192966_3192_1920x.jpg', '320x': 'https://i6.photo.2gis.com/images/profile/844424966192966_3192_320x.jpg', '640x': 'https://i6.photo.2gis.com/images/profile/844424966192966_3192_640x.jpg', '64x64': 'https://i6.photo.2gis.com/images/profile/844424966192966_3192_64x64.jpg', 'url': 'https://i6.photo.2gis.com/images/profile/844424966192966_3192.jpg'}, 'url': '', 'additional_data': {'email': None}}",,[],"{'status_history': [], 'has_unresolved_complaints': False, 'pin_status': 'none', 'ip': '', 'user_agent': '', 'external_id': None, 'filtered_facts': None, 'is_unrated_permanently': None, 'is_liked': None}",False,True,False
6309233,19,"Квартирные взломы случаются все чаще, злоумышленников становится все больше, поэтому о безопасности своей квартиры лучше побеспокоиться заранее, в принципе, я так и сделал. Как только купили квартиру, решили поставить ее под охрану, не хочется уходить на работу и переживать. В интернете перебрал много компаний занимающихся охранными системами, но вот «Дельта прям, привлекла мое внимание, много полезной информации на сайте, обо всех системах, цены, в общем, все, что нужно знать потребителю есть на сайте. Сразу же оформил заказ не беспроводной комплект охранной и тревожной сигнализации, решил вооружиться полностью. Сначала хотел выбрать только охранную сигнализацию, но посмотрел на абонлату того и того, понял, что от 100 рублей в месяц не разбогатею, а двойная охрана безопаснее будет. Специалисты приехали и установили все в оговоренный день, справились за 2.5 часа, считаю, что это быстро. Все оборудование проверяли вместе, все работает, срабатывает. Тревожной кнопкой за 5 месяцев еще ни разу не пользовались, слава Богу, она лежит в нашей спальне, так спокойнее. Может она и не нужна вовсе, но мне она не мешает, жене тоже, да и переплачиваешь за нее копейки. С выбором компании я точно не ошибся, обслуживание нормальное, специалисты хорошие, стоимость системы нормальная, может и есть дешевле, но я не ищу, и не и скал, нас с женой все устраивает!",5,flamp,,False,,,https://flamp.ru/r/2674540563987556/4159074,0,0,2018-04-15T03:51:28.0+07:00,,"{'id': '2674540563987556', 'type': 'branch'}","{'id': '2312173', 'reviews_count': 1, 'first_name': 'alekskhl', 'last_name': None, 'name': 'alekskhl', 'provider': 'flamp', 'photo_preview_urls': {'1920x': 'https://cdn1.flamp.ru/default-avatar-m_1920.png', '320x': 'https://cdn1.flamp.ru/default-avatar-m_320.png', '640x': 'https://cdn1.flamp.ru/default-avatar-m_640.png', '64x64': 'https://cdn1.flamp.ru/default-avatar-m_64_64.png', 'url': 'https://cdn1.flamp.ru/default-avatar-m.png'}, 'url': 'http://flamp.ru/user2312173', 'additional_data': {'email': None}}",,[],"{'status_history': [], 'has_unresolved_complaints': False, 'pin_status': 'none', 'ip': '', 'user_agent': '', 'external_id': '4159074', 'filtered_facts': None, 'is_unrated_permanently': None, 'is_liked': None}",False,True,False
6309233,19,"Квартирные взломы случаются все чаще, злоумышленников становится все больше, поэтому о безопасности своей квартиры лучше побеспокоиться заранее, в принципе, я так и сделал. Как только купили квартиру, решили поставить ее под охрану, не хочется уходить на работу и переживать. В интернете перебрал много компаний занимающихся охранными системами, но вот «Дельта прям, привлекла мое внимание, много полезной информации на сайте, обо всех системах, цены, в общем, все, что нужно знать потребителю есть на сайте. Сразу же оформил заказ не беспроводной комплект охранной и тревожной сигнализации, решил вооружиться полностью. Сначала хотел выбрать только охранную сигнализацию, но посмотрел на абонлату того и того, понял, что от 100 рублей в месяц не разбогатею, а двойная охрана безопаснее будет. Специалисты приехали и установили все в оговоренный день, справились за 2.5 часа, считаю, что это быстро. Все оборудование проверяли вместе, все работает, срабатывает. Тревожной кнопкой за 5 месяцев еще ни разу не пользовались, слава Богу, она лежит в нашей спальне, так спокойнее. Может она и не нужна вовсе, но мне она не мешает, жене тоже, да и переплачиваешь за нее копейки. С выбором компании я точно не ошибся, обслуживание нормальное, специалисты хорошие, стоимость системы нормальная, может и есть дешевле, но я не ищу, и не и скал, нас с женой все устраивает!",5,flamp,,False,,,https://flamp.ru/r/2674540563987556/4159074,0,0,2018-04-15T03:51:28.0+07:00,,"{'id': '2674540563987556', 'type': 'branch'}","{'id': '2312173', 'reviews_count': 1, 'first_name': 'alekskhl', 'last_name': None, 'name': 'alekskhl', 'provider': 'flamp', 'photo_preview_urls': {'1920x': 'https://cdn1.flamp.ru/default-avatar-m_1920.png', '320x': 'https://cdn1.flamp.ru/default-avatar-m_320.png', '640x': 'https://cdn1.flamp.ru/default-avatar-m_640.png', '64x64': 'https://cdn1.flamp.ru/default-avatar-m_64_64.png', 'url': 'https://cdn1.flamp.ru/default-avatar-m.png'}, 'url': 'http://flamp.ru/user2312173', 'additional_data': {'email': None}}",,[],"{'status_history': [], 'has_unresolved_complaints': False, 'pin_status': 'none', 'ip': '', 'user_agent': '', 'external_id': '4159074', 'filtered_facts': None, 'is_unrated_permanently': None, 'is_liked': None}",False,True,False
