Company,City,Name,Date,Review
Группа компаний безопасности Полюс,SARAT,Алексей Г.,11 марта 2020,Хорошая компания дружный коллектив где работают достойные и квалефецированные работники
Группа компаний безопасности Полюс,SARAT,Nuboed .,14 апреля,Хорошая организация
Группа компаний безопасности Полюс,SARAT,Александр Ф.,4 сентября 2019,Дружный коллектив. Первоклассные специалисты.
Группа компаний безопасности Полюс,SARAT,Сергей К.,8 марта 2020,Наведите порядок.украсте фасад
Группа компаний безопасности Полюс,SARAT,Евгений Волков,26 октября 2019,"Хорошая организация,работал"
ЧОП Омега-98,SARAT,529174 Алмосова,20 февраля,"Хорошее охранное предприятие, посетила их офис, впечатление благоприятное. Обслуживание без задержек, профессионально работает юрист, быстро заключили договор на охрану. ГБР приезжает быстро. Всем советую данную охрану."
ЧОП Омега-98,SARAT,Анатолий С,21 апреля,"Сразу понял, что опыт у фирмы глобальный. Вошли на объект с пониманием ситуации, сразу включились в работу. Сотрудничаем и по сей день, к работе охраны претензий нет."
ЧОП Омега-98,SARAT,Артем Скорынин,19 апреля,"Ужасная компания, работают способами из 90, был заключён договор, допустили небольшую просрочку сразу подали в суд, бегите от них , никому не советую с ними связываться"
ЧОП Омега-98,SARAT,Юлия Х,21 апреля,Самая лучшая охрана!!!  Приятно иметь дело с профессионалами своего дела !!!! Так держать!!!
ЧОП Омега-98,SARAT,Александр,7 ноября 2020,"Все положительные отзывы сотрудников заставляет писать учредитель или кто то по его просьбе!!! Не верьте!!! Не ходите туда устраиваться на работу!!! 
Если конечно не хотите чтобы вас через ...... кинули..... 
Всем добра!!!"
ЧОП Омега-98,SARAT,Екатерина С.,2 ноября 2020,"После определенных инцидентов у нас в подъезде, нужно было решать вопрос с охраной. Обратились в эту компанию. Установили сигнализацию с выводом на пульт управления. Цены за услуги адекватные, все устраивает."
ЧОП Омега-98,SARAT,Auto Auto,10 ноября 2020,"Отвратительная организация. Хамское отношение к людям. Если выполнили работу не правильно, никогда с этим не согласятся. Если хотите сберечь свои нервы, то я не советую вам с ними общаться.  Обходите эту организацию стороной."
ЧОП Омега-98,SARAT,Татьяна Е.,26 февраля 2020,"Отличная организация! Приемлемые цены! 
Оперативные группы ГБР, по тревоге приезжают за 3-5 минут. оперативно!
Кому нужна охрана, как физическая, так и пультовая - ВСЕ В ""ОМЕГУ"". 
Рекомендую!!!"
ЧОП Омега-98,SARAT,Ольга А.,21 ноября 2019,Спасибо огромное! Качественно и быстро запультировали объекты) Приятно иметь дело с такой организацией! Буду рекомендовать Всем знакомым Вашу организацию!
ЧОП Омега-98,SARAT,Алексей Проскурин,5 октября 2020,Зарплата небольшая. Иногда бывают задержки. В целом работать можно.
ЧОП Омега-98,SARAT,Дмитрий Калашников,27 февраля 2020,Организация нормальная не кидать но за низкая по сравнению с другими ЧОП
ЧОП Омега-98,SARAT,вика а.,23 октября 2016,"Рекомендую данную охранную организацию ""Омега "" для рестораторов и владельцев развлекательных заведений ."
ЧОП Омега-98,SARAT,Антон С.,23 апреля 2016,""" Омежка "" самая популярная охранная организация города Саратова . Так ласково ее называют друзья !!!"
ЧОП Омега-98,SARAT,сергей и.,15 марта 2016,Рекомендую всем учебным образовательным учреждениям !!!
Контр Групп,SARAT,Азат Узянбаев,6 ноября 2020,"Охранная организация на отлично! Сделал вывод когда обратился к ним за помощью. Оказали услуги на отлично, приятные и профессиональные сотрудники и руководители."
Контр Групп,SARAT,ООО ЧОО Тех-Защита,9 марта 2020,"напротив - ассоциация Собос-Русь.
Вы там найдете всё, что надо для надежной охраны"
Контр Групп,SARAT,Fff Fff,29 июля 2020,"Всё чётко, быстро, качественно."
Контр Групп,SARAT,Малик М.,10 сентября 2019,"Коллектив отличный,условия хорошие,зарплата вовремя."
Контр Групп,SARAT,Олег Ермаков,6 октября 2020,Хочешь  лицензию тебе сюда
Гранит,SARAT,Артем М.,25 января 2020,охрана очень нормальная
Гранит,SARAT,Константин,27 августа 2015,"За людей не считают рядовых охранников , ещё кидают на деньги и зарабатывают на форме(заставляют её покупать в три дорого!)."
Берт,SARAT,Сергей К.,19 августа,Хорошо выполняют свою работу.
Собос,SARAT,Алексей Ку.,5 мая,"бандформирование под надписью ЧОП, их гопота плевала на законы и нарывается на грубость. ЧТоб не быть голословным ссылка на видео https://www.youtube.com/watch?v=lCXAA6B2Y3o"
Собос,SARAT,аполлон олимпийский,25 сентября 2020,"Люди для них расходный материал,средства на которых они зарабатывают. Платят копейки,зато зарабатывают на людях огромные деньги. Используют ситуацию с короновирусом чтобы дистанцироватся от работников и тормозить оплату. Незаконно штрафуют. Люди для них скот не более того. Совершают преступления и друг друга покрывают особенно в Собос-Газ"
Собос,SARAT,Andrewt64,11 ноября 2020,"Сложилось впечатление что люди не люди для руководителей. Нормально без задержек платили только первые полгода потом начались задержки. Ладно б получали бы как в мск по 30+к р, так получаем меньше минималка и то с задержками и без авансов. Забыл что такое аванс и отпуск благодаря этой конторке"
Собос,SARAT,Y,4 августа,Околевает очередная саратовская помойка
Собос,SARAT,Дмитрий В.,24 марта 2020,"Очень много организаций.Работу найти можно,но очень дешёвая работа и деньги вовремя не отдают многие"
Собос,SARAT,Denis Savin,3 марта 2020,Работают настоящие профессионалы!
Собос,SARAT,Дед Парамон,8 апреля 2020,Серьезная организация
Тех-защита,SARAT,Василий С.,12 января 2020,"Самое лучшее охранное предприятие на территории Саратовской области. Грамотные технические специалисты, имеющие огромный опыт работы, обеспечат качественные услуги охраны объектов, квартир и коттеджей, расположенных не только в г.Саратове и Энгельсе, но и на всей территории Саратовской области."
Тех-защита,SARAT,radiys-s,3 февраля,"Лучшая организация, в ассоциации ""Собос-русь"""
Тех-защита,SARAT,Andrey S.,3 апреля 2020,Хорошая организация
Приоритет-Св,SARAT,Алла Скрябина,14 августа,"Вы когда набираете сотрудников, то как то тестируете их или лишь бы кого взять? Неоднократно столкнулись с непрофессионализмом, хамством, быдлячеством вашей сотрудницы! В учебном заведении ходит в серебряной обуви стриптизерш, всем ""тыкает"", хамит, орёт. Ген. Дир не меньше! Маргинальные личности не должны работать в учебных заведениях!"
Приоритет-Св,SARAT,Виктор Евстигнеев,16 февраля 2018,Не серьезная организация.
Радон-С,SARAT,Мария Иванова,21 октября 2020,"Сотрудницы охранного агентства Радон-С пенсионного возраста (или женщины за 50) отличаются хамством и публичными оскорблениями. Не выполняют или превышают свои полномочия. Позволяют себе неуместные комментарии в адрес проходящих, не имеющие к их работе никакого отношения. В общем, такая работа - отличный способ для таких бабулек развлечься на рабочем месте, давая проходящим свои ""мудрые"", ненужные никому советы."
Радон-С,SARAT,Дмитрий Русанов,14 февраля,"Поработал одну смену не понравилось.За смену деньги не отдали ,по"" мужицки"" поступают.Ощущение,что тебя вообще не слышат,когда объясняешь какой объект хочешь."
Радон-С,SARAT,Ольга Пенькова,4 апреля 2020,рекомендую пенсионерам как доход к пенсии
Радон-С,SARAT,Олег Алексеев,15 февраля 2020,Крупное  охранное предприятие.
Радон-С,SARAT,Марина,23 июля 2019,Отличная команда
Лион-Альянс,SARAT,Галина @@@@,19 октября 2020,"По зарплате постоянно задержки. Сегодня 19 октября, до сих пор нет зарплаты за август. Директор только обещает сегодня-завтра"
Лион-Альянс,SARAT,Владимир Сафьянов,10 сентября,Охранное предприятие. ГБР.
ЧОП Гарант-Саратов,SARAT,Воротников Сергей,3 мая,Лучшее охранное предприятие в городе.
ЧОП Гарант-Саратов,SARAT,@@@ @@@,12 января,Серьёзная организация... ответственный подход к работе.
ЧОП Гарант-Саратов,SARAT,Александр Л.,13 июля 2020,Профессионалы!!!✊✊✊в конторе работают нормальные люди!
ЧОП Гарант-Саратов,SARAT,$,26 декабря 2020,"Не платят ни кому, кидают."
ЧОП Стелс,SARAT,aadimitryk,4 января 2020,Под охраной ЧОП находится не мало объектов. География - вся Саратовская область.
Саратовский отряд ведомственной охраны,SARAT,АЛЕКСЕЙ К.,30 октября 2020,Отстойник для пенсионеров.
Саратовский отряд ведомственной охраны,SARAT,Светлана Бугаева,29 ноября 2020,Слишком низкие зарплаты
Филиал ФГУП Охрана Росгвардии по Саратовской области,SARAT,Дмитрий Я.,29 октября 2019,"Бюрократия наше всё, а в остальном нормально."
Филиал ФГУП Охрана Росгвардии по Саратовской области,SARAT,Анонимный отзыв,10 июня 2020,Так вот где они прячутся.
Соломон,SARAT,BannerSvet,29 ноября 2020,Хорошая автостоянка. Украшает её ели в доль территории
Соломон,SARAT,Александр Косенко,13 июля 2020,Хорошо делают шиномонтаж
Соломон,SARAT,Анонимный отзыв,8 ноября 2016,"Работают быстро, качественно без задержек.
Остались довольны."
Соломон,SARAT,Сергей,22 ноября 2018,Хороший шиномонтаж.
ФГП ВО ЖДТ РФ,SARAT,Светлана Бугаева,29 ноября 2020,Слишком низкие зарплаты
